author_username,created_at,impression_count,like_count,reply_count,retweet_count,text,word_count
SagiBarmak,1689364658,17607,239,35,4,"עילת הסבירות הורחבה על ידי בית המשפט בהסכמה רחבה? הייתה הסכמה רחבה בנוגע להפיכת חוות הדעת של היועץ המשפטי לממשלה למחייבת? זכות העמידה הורחבה בהסכמה רחבה? חביבי, *אתם* שיניתם את השיטה בלי הסכמה רחבה. אגב, מה נראה לך יעשו משרתי המילואים מהימין כמוני אם הטייסים יורידו את הממשלה על…",49
SagiBarmak,1691670841,99785,631,164,37,אני מבין שהמחאה נכנסה לשלב המקארתיזם. שאולי שארף הוא בחור מבריק. מרצה אצלנו בתכנית אקסודוס. הפסד ענק לתלמידים ובושה גדולה לבית הספר.,22
SagiBarmak,1695204439,12026,225,19,7,"אחרי שניגבו את הרצפה עם טל רוסו, עכשיו מגיע תורו של בני גנץ לקבל טיפול דומה. בסוף, בישראל אין אופוזיציה פרלמנטרית אלא אוסף יוצא-דופן של בריונים, יאיא פינקים למיניהם ומילואימניקים בגיל פרישה שחושבים שיש להם זכויות יתר. שקיעתה של האופוזיציה המפלגתית.",41
SagiBarmak,1692091628,10649,91,51,2,"שלושה שינויים דמוקרטיים חשובים שניתן לגבש סביבם הסכמה רחבה בקלות יחסית: 1. הכנסת לא תפסול מפלגות על רקע תוכני-מהותי. במילים אחרות: חופש כניסה מוחלט לשוק הפוליטי. 2. הורדת אחוז החסימה לשם הגדלת ייצוגיות הכנסת. 3. מתן הגנות חוקיות לזכויות האזרח הבאות: הזכות לבחור ולהיבחר, חופש…",45
SagiBarmak,1690098245,27264,352,76,35,הטיעון הכי טוב ששמעתי בזכות מלוכה בחסד האל.,8
SagiBarmak,1695017876,6294,174,44,1,המטורללים האלה זוכים למכובדות ציבורית ותקשורתית ולחיבוק מהאופוזיציה. זמנים עצובים.,10
SagiBarmak,1694100866,30885,1406,254,3,"אבי האהוב הלך עתה לעולמו לאחר מאבק עיקש במחלת הסרטן, כשהוא לצד משפחתו. איבדתי אבא יוצא דופן שאין כדוגמתו. תנוח בשלום על משכבך אבא יקר.",25
SagiBarmak,1696668200,6831,177,20,3,"תחשוב שבהערכת המצב ביום ראשון ישב הרמטכל, ראש השבכ והמזכיר הצבאי ואמרו כולם שחמאס מורתע ושיש להימנע מפרובוקציות. האחריות בהחלט מוטלת על הממשלה- ועוד נבוא איתה בחשבון. אבל הטנטרום שלך ושל אחרים הוא חרפה מדהימה.",35
SagiBarmak,1687680724,2602,116,2,3,מצויין. לא לתת ללוביסטים לתקוע מקלות בגלגלים. להתנגד לכל החרגה כנקודת מוצא.,12
SagiBarmak,1691680931,51980,601,107,69,"רון דיסנטיס, מושל פלורידה, פיטר היום את פרקליטת המדינה. הסיבה? החלטות שאינן עולות בקנה אחד עם המדיניות שהוא מתעקש להתוות כמושל: יד קשה כלפי פושעים. מסתבר שחוקת פלורידה לא שמעה על דוקטרינת ""שומרי הסף"". שימו לב ללשון החוקה בציוץ העוקב 👇",41
SagiBarmak,1688732238,3220,82,8,2,"אגו ופוליטיקה אלה תכונות של נבחרי ציבור. עורכי דין בשירות הציבורי (""שומרי סף"", סליחה) זה חומר אחר.",17
SagiBarmak,1689691812,655,26,2,0,"בהחלט, רק לא ברור לי למה לא הפגנת על זה בזמן ממשלת השינוי? או למה אתה מפגין ברכבת תל אביב ולא בבני ברק או מאה שערים?",26
SagiBarmak,1688722456,1788,22,2,3,התכניות שלנו במכון ארגמן פתוחות להרשמה. בואו ללמוד איתי ועם שאר צוות המכון. קישורים 👇,15
SagiBarmak,1690794624,2112,111,3,14,"""אינני שמח על חדירת הפוליטיקה אל תוך הליך מינוי השופטים בארצי. אולם בכנות, אני מעדיף את זה על החלופה שהיא שלטון אריסטקרטיה שיפוטית"". אנטונין סקטליה. (מתוך: ""שופטים ככוהני דת"") 👇",30
SagiBarmak,1696325007,5413,77,2,2,למה רק לירוק? אולי נכה אותם? נגרש אותם מהארץ? נשעבד אותם? לא מתאים לך לגלות כזו חלביות. אולי זה בהשפעת התרבות המערבית...,22
SagiBarmak,1690794815,3283,48,6,1,מישהו מדמיין לעצמו שתחת ההסדר הקיים לבחירת שופטים בישראל שופט מן הסוג של סקאליה יוכל להתמנות לעליון שלא על דרך המקרה הקוסמי?,22
SagiBarmak,1693571438,13530,282,38,21,"אני בטוח ש- מכיר את הקביעה ""אין מיסוי ללא ייצוג"". אז הנה עוד קביעה שרצוי להכיר: ""אין ייצוג ללא בחירה"". אם הגברת מיארה רוצה ""לייצג את הציבור"" ולא את הלקוח שלה (הממשלה), היא צריכה לקבל לשם כך את הסכמת הציבור. היא מוזמנת להציב את עצמה לבחירה ולהפוך לנציגת ציבור.",49
SagiBarmak,1695641304,46292,507,249,37,"מעדכוני יום הכיפורים בתורת המדינה: ליברליזם זה כשאתה מחבל, משפיל, מקלל ומקטין יהודים אחרים שמבקשים - מרצונם החופשי ומבלי שפגעו בחיים, ברכוש או בחופש של אף אדם אחר- לקיים תפילה עם מחיצה בפרהסיה.",33
SagiBarmak,1688926899,31067,881,136,86,"חברים, אנחנו בעיצומה של פסיכוזה ציבורית חסרת תקדים. האליטה האינטלקטואלית, התקשורתית והתרבותית ועמה כל הצמרת הביטחונית בדימוס מנסה לשכנע את הציבור שאם דעתה של עורכת דין שמינתה האופוזיציה ושתפקידה בכלל לייעץ לא תהיה מחייבת- ישראל תחדל מלהיות דמוקרטיה. מה קורה כאן?",41
SagiBarmak,1692452151,1614,110,2,2,"התכוונת למבוא ליוריסטוקרטיה. בספר הלימוד היוריסטוקרטי, בית המשפט העליון הוא האופוטרופוס של הכנסת שמבקר לא רק את חוקיה הרגילים אלא את חוקי היסוד עצמם וזאת ללא קיומה של אף סמכות שהעם העניק לו.",33
SagiBarmak,1688051035,8251,190,11,6,"וואו. וואו. וואו. פסיקה היסטורית של בית המשפט העליון השמרני בארצות הברית: מבטל ""העדפה מתקנת"" מבוססת גזע במוסדות להשכלה גבוהה כלא-חוקתית. האם מבחינת הדמוקרטים זה יהיה הקש שישבור את גב הגמל בנוגע ליחסם לעליון? יש למה לצפות.",37
SagiBarmak,1688057824,190,1,0,0,שוב? הדמוקרטים צריכים רוב בקונגרס שכרגע אין להם.,8
SagiBarmak,1690293911,12979,325,17,7,יהודי שירד מהארץ מגרש מהעסק שלו את שגרירה של מדינת היהודים שמונה לתפקידו על ידי ראש האופוזיציה. הגיוני בסך הכל.,20
SagiBarmak,1687026550,333,23,0,0,אין על האתיקה התקשורתית שלך. פודל השמירה של המחאה.,9
SagiBarmak,1690658335,80650,509,88,19,שלום ליובל נח הררי. שיטת המשטר האמריקאית שאליה אתה משווה את זו הישראלית בבוז מופגן לא מנעה (בין היתר) את התופעות הבאות: 1. עבדות 2. סגרגציה גזעית 3. מלחמת אזרחים 4. אאוגניקה נרחבת 5. כליאה המונית של אזרחים ממוצא יפני 6. מקרתיזם 7. הכחדה של אוכלוסיה ילידית 8. הסתערות על הקפיטול…,51
SagiBarmak,1690531435,50891,326,71,37,עד למהפכה החוקתית התקיימה בישראל הפרדת רשויות מצויינת. הכנסת חוקקה. בית המשפט יישב סכסוכים בכפוף ובהתאם ללשון החוק. כל רשות ותכליתה. המהפכה החוקתית הראשונה היתה הפגיעה הראשונה בעקרון הפרדת הרשויות. לקחו בית משפט שנהנה מאמון ציבורי נרחב ושהצליח להעניק סעד ולהגן על זכויות והכניסו…,44
SagiBarmak,1695037818,30305,662,117,44,"אין פרה קדושה אחת שהמחאה הזו לא שחטה. אקדמיה, רפואה ציבורית, עבודה מאורגנת, צה""ל, תקשורת, יחסים בינלאומיים, מורשת בן-גוריון, מגילת העצמאות- תחום אחר תחום עבר פוליטיזציה בדורסנות מבהילה. סילופים, שקרים, נרטבים כוזבים וחשיבות עצמית מופרזת. מקווה שנתאושש מזה כחברה.",39
SagiBarmak,1695102564,5192,145,16,18,"מאמר מערכת מחמיא מאוד לנתניהו ומעניין מאוד הבוקר באופן כללי ב-WSJ. המאמר, שהולם את ההתבטאויות של נתניהו, מסמן למעשה את קו הסיום של האפיזודה כולה- שינוי בועדה לבחירת שופטים שימסד שוויון בין קואליציה לאופוזיציה. בלי שופטים. בלי נציגי לשכה. זו פסקת המפתח במאמר 👇",44
SagiBarmak,1689403136,61714,727,179,79,"מסתבר שלממשלה שזכתה באמון הכנסת לאחר בחירות חופשיות אסור: 1. לצמצם את עילת הסבירות וזכות העמידה לאחר שבית משפט אקטיביסטי הרחיב אותן. 2. לבטל את הגרעון הדמוקרטי בועדה לבחירת שופטים לאחר שבית המשפט לקח לידיו את הכוח לבקר לא רק חקיקה ראשית אלא אף את חוקי יסוד. 3. לצמצם את הכוח של עורכת דין שחוות דעתה ושיקול דעתה הפכו למחייבים. הצעדים האלה, שלא נוגעים באף זכות פוליטית ובאף עקרון יסוד של הדמוקרטיה הפרלמנטרית שלנו, תוייגו כ""הפיכה שלטונית"". לא פחות. ומהרגע הזה כל מהלך קיבל הכשר- מהפוליטיזציה הגלויה של האקדמיה והתקשורת ועד לפגיעה בכשירות המבצעית של צה""ל. תסכול של מחנה שהפסיד בבחירות ושביצר את כוחו בבית המשפט יצא החוצה בהתקפה עזת מצח על הדמוקרטיה הפרלמנטרית.",114
SagiBarmak,1689407180,392,14,2,1,לא לומדים שם סבירות. יכול למנות את הקריטריונים האובייקטיבים למבחן סבירות?,11
SagiBarmak,1691610112,2546,191,7,5,"זה *לא* הסבר ממצה. למעשה, זה כלל לא הסבר. יניב יכול לטעון שלבית המשפט ""סמכות אינהרנטית"" עד מחר- על זה בדיוק הויכוח. מאיפה הסמכות הזו צצה? מי העניק אותה? למה יש לה תוקף? איך היא עולה בקנה אחד עם עקרונות הדמוקרטיה? כאמור, אין כאן אפילו התחלה של הסבר.",48
SagiBarmak,1689256762,3851,161,19,14,"אם בית המשפט יכול לקבוע שמי שעומד בראש מפלגה בינונית לא יכול לכהן כשר, למה שלא יקבע על הדרך שהעומד בראש המפלגה הגדולה ביותר לא יכול לכהן כראש ממשלה? אתם רואים פה איום על הדמוקרטיה. הם רואים כאן מבחני סבירות.",40
SagiBarmak,1696660877,18509,339,21,16,בהחלט. זה מסתמן כמו אירוע שמצדיק ועדת חקירה ממלכתית לצד השבה של המנדט לציבור. הייתי דורש את זה אם המחדל היה מתרחש תחת ממשלת שמאל. צריך לדרוש את זה גם כשהאירוע יסתיים.,32
SagiBarmak,1689857594,17055,300,79,25,"האירועים האחרונים גרמו לי להעריך מחדש את האומץ, החלטיות, נחישות והמנהיגות של בן-גוריון. בלי למצמץ או להסס הוא פירק, בעיצומה של מלחמת הישרדות, את מה שהייתה בזמנו יחידת עילית (הפלמ""ח) שנהנתה מיוקרה חברתית ופוליטית עצומה ביישוב. הטייסים עם היד על השאלטר הם הפלמ""חניקים של ימינו.",45
SagiBarmak,1692725447,7016,179,15,12,"לא היינו משלימים עם הפקרות שכזו בתל-אביב, חיפה או אשדוד. באופן דומה אנחנו לא צריכים להשלים עם אנרכיה בסכנין, אבו-סנאן או טירה. ילד ערבי זכאי לביטחון בדיוק כמו ילד יהודי. אזלת היד של הממשלה בנושא הפשיעה היא מחדל מטורף.",39
SagiBarmak,1689529211,1848,127,10,1,מה מונע מבית המשפט לעשות שימוש לרעה בכוח שלו?,9
SagiBarmak,1695790316,12607,463,24,12,מעניין איך בוחרים שופטים בממלכה הדמוקרטית של סעודיה.,8
SagiBarmak,1696664292,8610,65,7,12,מטורף לגמרי שאלה הדברים שנאמרו בהערכת המצב. שידוד מערכות- צו השעה.,11
SagiBarmak,1696493210,3258,41,18,2,"הגיע הזמן לחשוב על הרפורמות שלאחר הרפורמה. חשובים ככל שיהיו, שינויים נחוצים במערכת המשפט אינם ממצים את כל השינויים שיש לקדם בשיטת המשטר שלנו. במאמר המצורף ב- אני מצביע על מספר צעדים שהממשלה יכולה להניע שיטיבו עם הדמוקרטיה שלנו.",39
SagiBarmak,1695726081,2573,91,6,7,תארו לכם שהמדינה תנסה לפתור את משבר הדיור באמצעות חלוקת דירות בהגרלות. דמיינו לכם שהמדינה תנסה לפתור את הסכסוך על ידי חלוקת נשק לכנופיית מרצחים והחזרה חד-צדדית של שטחים. חייבים את עילת הסבירות!,33
SagiBarmak,1695329521,200,3,1,0,אבל זו בדיוק הנקודה. אנחנו מוותרים על מנגנון עדכון יעיל למדי (מנגנון מחירים חופשי) לטובת מנגנון קיבוצי יעיל פחות. תעדכן באופן הזה את שכר המוסכניקים והאופים ותקבל את אותה תוצאה. זה בדיוק מה שטענתי בציוץ.,35
SagiBarmak,1695277023,2361,55,7,4,"הרפורמה המשפטית מגיעה ל-Reason, האתר הליברטריאני המוביל בארה""ב. טור מצויין של דיוויד ברנשטיין.",13
SagiBarmak,1695104127,7829,191,17,13,"שימו לב לפסקה שהדגשתי במכתבו של נשיא אוניברסיטת תל-אביב. במקרה הטוב, טענתו של פורת שנויה במחלוקת. במקרה הפחות טוב (מבחינתו), טענתו שגוייה לגמרי. בדמוקרטיות פרלמנטריות, המילה האחרונה בכל הסוגיות החוקיות והחוקתיות שמורה לפרלמנט. הפרלמנט עליון. עליונות הכנסת. בית המשפט שואב את כוחו וסמכותו מן החוק. חוק שהוא יציר ידו של המחוקק. הוא לא יכול להציב את עצמו מעל החוק במעשה פרשנות והוא אינו יכול ליצור לעצמו סמכות יש מאין. הוא תחום בגבולות הדין. למעשה, המדינות היחידות שמאפשרות לבית המשפט לשמש כפרשן הסופי והמוסמך של ההסדרים החוקתיים הן גם אלה שהכפיפו את בחירת השופטים להליך פוליטי- משהו שפורת וחבריו מסרבים בתוקף לעשות. כך או אחרת, מה לכל הרוחות מוביל את נשיא האוניברסיטה לצאת בקביעה כה נחרצת וכה רעועה? אני מקווה מאוד שכל תלמיד שנה א' למשפטים יוכל להעמיד את הנשיא הנכבד על טעותו.",132
SagiBarmak,1695104123,2639,67,4,4,"שימו לב לפסקה שהדגשתי במכתבו של נשיא אוניברסיטת תל-אביב. במקרה הטוב, טענתו של פורת שנויה במחלוקת. במקרה הפחות טוב (מבחינתו), טענתו שגוייה לגמרי. בדמוקרטיות פרלמנטריות, המילה האחרונה בכל הסוגיות החוקיות והחוקתיות שמורה לפרלמנט. הפרלמנט עליון. עליונות הכנסת. בית המשפט שואב את כוחו וסמכותו מן החוק. חוק שהוא יציר ידו של המחוקק. הוא לא יכול להציב את עצמו מעל החוק במעשה פרשנות והוא אינו יכול ליצור לעצמו סמכות יש מאין. הוא תחום בגבולות הדין. למעשה, המדינות היחידות שמאפשרות לבית המשפט לשמש כפרשן הסופי והמוסמך של ההסדרים החוקתיים הן גם אלה שהכפיפו את בחירת השופטים להליך פוליטי- משהו שפורת וחבריו מסרבים בתוקף לעשות. כך או אחרת, מה לכל הרוחות מוביל את נשיא האוניברסיטה לצאת בקביעה כה נחרצת וכה רעועה? אני מקווה מאוד שכל תלמיד שנה א' למשפטים יוכל להעמיד את הנשיא הנכבד על טעותו.",132
SagiBarmak,1694963584,2457,85,10,5,"אגב ליברליזם, ההגבלות השרירותיות הללו על יהודים לא יכולות לעלות בקנה אחד עם אף תפיסה חירותנית. הסיבה היחידה שההסדר הזה מתקיים הוא שאלימות ערבית מרתיעה אותנו.",26
SagiBarmak,1694788648,658,32,3,2,"אין חוק, יש ""עקרונות וערכים"" (שיצחק זמיר ודומיו אמונים כמובן על פירושם). יש ""טענות חזקות"", בז'ורנלים אקדמיים (שבהם יצחק זמיר ודומיו מצטטים האחד את השני). הכל יש, חוץ מהסכמה והסמכה דמוקרטית מפורשת שניתנה על ידי הציבור. על זה נאמר- והעם היכן?",41
SagiBarmak,1693858469,2200,66,3,2,"""פורום המרצים למען דמוקרטיה"" פרסם מסמך שבו - בין השאר - הוא מבקש לחשוף שתומכי הרפורמה מנכסים לעצמם מושגים במדע המדינה שכמובן רק לחברי הפאנל היוריסטוקרטי יש עליהם מונופול. מה אני לומד מהמסמך? ובכן לא רק את זה שחברי הפורום עדיין לא מבינים שהרשות השופטת היא רשות שלטונית לכל דבר ועניין וככזו גם היא זקוקה לבלם ואיזון. אני לומד גם שהם הכפיפו את כל עולם המושגים של תורת המדינה לחזון היוריסטוקרטי שלהם. טקסט שכזה היה נתקל בתדהמה על ידי גדולי החוקרים בתחום לפני עשורים לא רבים.",86
SagiBarmak,1693764598,17827,381,19,40,"אני לא מכיר את פרטי סערת דני דיין ויד שם ולא רוצה להתייחס לסיפור. אבל בכל הנוגע להתערבות של הממשל האמריקאי בסוגייה- לא ברור איך הדבר הזה עבר מבלי שאנשים חשו במבוכה או לפחות התפוצצו מצחוק. שתבינו, כשביידן עלה לשלטון הוא פצח בטיהור שיטתי של מינויים קודמים. מהאקדמיה הצבאית ועד לספרית הקונגרס, כל מינוי של טראמפ נדרש להתפטר מתפקידו. זו התרבות הפוליטית האמריקאית וצריך הרבה חוצפה מצד הממשל להעיר לבעלת ברית בסוגיה.",72
SagiBarmak,1693733893,13651,353,31,20,מגיעים לקמפוס אנשים שאני לא מסכימה איתם- בואו נסתום להם את הפה ונפוצץ את האירוע. המנטליות הבולשביקית אינה מפתיעה. מה שמשעשע זה חוסר ההיכרות עם הניאוקונס. היא אשכרה חושבת שהחבר'ה שלקחו חלק פעיל בהבסת אימפרית הרשע תחת רייגן מתרגשים מזמבורות.,40
SagiBarmak,1693594046,681,36,0,5,ושימו לב לנבואה הבאה של גביזון שכמובן התגשמה במלואה:,9
SagiBarmak,1693593887,1517,52,5,4,"רות גביזון על הטענה לפיה הלקוח של היועץ המשפטי לממשלה הוא ""הציבור"":",12
SagiBarmak,1693582045,1772,9,1,0,"מדוייק. הוא מנהל דיון עם ""טיעוניו שלו"" ועם שופטים אחרים. והעם, היכן הוא? מתוך מאמר הביקורת שלי על מאמרו של ברק:",21
SagiBarmak,1693461565,518,29,4,3,מה שחשוב לי במיוחד להדגיש זה שניתן פשוט לקחת את הטיעון של ברק ולסובב אותו. ככה זה יוצא במקרה שכזה:,20
SagiBarmak,1693461562,3084,169,9,18,ביקשו ממני לקרוא את מאמרו האחרון של אהרן ברק ולהתייחס אליו. זה מה שיצא 👇,15
SagiBarmak,1693415960,11875,418,17,30,תאיישו את בית המשפט באלרונים וסולברגים ותראו באיזו מהירות קוראים לביטולה של המהפכה החוקתית מעל דפי הארץ.,17
SagiBarmak,1693383609,2579,58,6,7,"בשנת 2015 קבע בית המשפט העליון בארצות הברית ברוב של 5:4 (כל 4 השופטים השמרנים שכיהנו באותה העת התנגדו) כי כל חוק ברמת המדינות שיגדיר נישואים כאיחוד בין גבר לאשה דינו להיפסל בשם התיקון ה-14 לחוקה. שימו לב לקטע הבא מתוך דעת המיעוט הזועמת של אנטונין סקאליה. הקטע הקצר הזה לוכד לדעתי במלואו את עיקרה של הביקורת השמרנית על בית המשפט לא רק בארצות הברית אלא בכלל ובפרט בישראל: טשטוש ההבחנה בין חקיקה למשפט, רמיסת הדמוקרטיה, בוז לתקדימים ולדין והיתלות בערכים נאורים שיש לכפות על הציבור, ועוד.",87
SagiBarmak,1693310143,3127,112,8,6,נבחרי הציבור מפריעים לפילוסופים של המשפט להגות את סדרי המשטר של מדינת ישראל.,13
SagiBarmak,1692967930,1876,44,3,3,"אמירה עקרונית של שופט בית המשפט העליון הבריטי, הלורד ג'ונתן סאמפשטיין, שלקחתי כמובנת מאליה ושאירועי השעה אצלנו גילו לי שהיא רחוקה מלהיות כזו.",23
SagiBarmak,1692901623,3017,73,8,3,"כשהתחיל הבאז סביב הרפורמה שאלתי חבר קרוב שסיים את לימודי המשפטים באוני' העברית האם במהלך לימודיו הוא נדרש לקרוא ברצינות את ג'רמי וולדרון. תשובתו היתה ""שהזכירו אותו בחטף באחד הקורסים"" ו""הסבירו לנו למה הוא טועה"". תכל'ס, הופתעתי לטובה. לפחות הזכירו אותו.",41
SagiBarmak,1692864925,2596,118,6,9,*תלונות על הציבור שמגלה חוסר סובלנות למומחים*. המומחים:,8
SagiBarmak,1692711528,2840,23,3,2,"אחרי שורה של נזיפות וציפיות, פרק חדש של מסיבת התה. הפעם דיברנו על שטראוס והגבלים עסקיים, רפורמת התקשורת, האם להפעיל את הרכבת בשבת ועל רדיפת התורמים של פורום קהלת. מוזמנים לצפות/להאזין וכמובן- לשתף.",33
SagiBarmak,1692626747,3458,91,16,10,בן-גוריון על המחשבה שבית המשפט העליון יפסול חוקים:,8
SagiBarmak,1692618877,884,16,1,0,"מה זה ""אבסולוטיזם דמוקרטי""? זה בן-גוריון מאותו הנאום:",8
SagiBarmak,1692561855,1109,15,0,1,קטע מצויין של ג׳רמי וולדרון על השיח האקדמי והציבורי סביב ״עריצות הרוב״. רלוונטי כמובן במיוחד גם למקרה הישראלי.,18
SagiBarmak,1692371119,1681,27,4,2,"""אני בעסק של לאכוף דמוקרטיה"". דקה וחצי נוספות של סקאליה. ככה בדיוק נשמע ליברליזם-דמוקרטי.",14
SagiBarmak,1692295694,3388,74,6,9,"קחו שתי דקות וצפו בשופט אנטונין סקאליה. רק תחליפו בדבריו את ""חוק הטבע"" ב""עקרונות היסוד של השיטה"" ואת הרווארד בפקולטה למשפטים באוניברסיטה העברית.",23
