author_username,created_at,impression_count,like_count,reply_count,retweet_count,text
ptr_dvd,1690129110,48804,1119,121,68,וואו יש ממש הרבה אנשים מכל צד. הלוואי והייתה לנו שיטה מוסכמת לקבל החלטות במצבי אי הסכמה באופן שייצג את היחס באוכלוסיה של כל עמדה.
ptr_dvd,1690123695,3718,243,12,26,"חשוב לזכור - ההצעה על הפרק היא תיקון לחוק יסוד השפיטה. אין לבית המשפט העליון סמכות לדון בחוקי יסוד. כפי שאמר היום פרופ' רון שפירא שישב לצדי אצל עופר חדד ב : ""אם בית המשפט יפסול את התיקון הזה לחוק היסוד זה יהיה לא לגיטימי. פסיקה כזו תהיה שערוריה""."
ptr_dvd,1690052537,21595,769,124,17,נדמה שלעצבן שמאלנים הפך לערך בפני עצמו בעיני אנשים מסוימים. אין דבר שמזיק יותר למדיניות הימין מאשר הגישה הזו.
ptr_dvd,1689856782,3877,260,6,25,"יש פה מאבק של אנשים שקיבלו לידיהם כוח בלתי מוגבל בכסות של ""משפט"". כל כוח משחית, לא רק כוח פוליטי. המענה לסכנה הזו אינו סימון של משפטנים כ""טובים"" או ""שומרי סף"" אלא שלטון חוק ואיזונים על כולם כאחד: על הרשות המחוקקת, על הרשות המבצעת, וכן, גם על הרשות השופטת."
ptr_dvd,1689856780,37767,642,22,97,"תהיו איתי דקה ונעבור על משתתפי הכנס שנערך היום ע""י לשכת עוה""ד נגד צמצום עילת הסבירות. הש' בייניש: פסקה ששרת המשפטים דאז ציפי לבני לא יכולה לכנס את הוועדה לבחירת שופטים על מנת למנות את רות גביזון ז""ל היות שמדובר היה בתקופת בחירות. אלא שבייניש עצמה מונתה בתקופת בחירות. &gt;&gt;&gt;"
ptr_dvd,1689844616,17047,402,71,28,"נתקעתי היום בפקק ארוך מאוד בכביש 1. הגעתי למוקד הפקק באזור משמר איילון. ניידות חוסמות נתיבים (ורכב אזרחי נוסף חונה לצידן). צוואר בקבוק נוראי. כל זה עבור 3 צועדים (באותו אזור, לא יודע מה קורה באזורים אחרים). לא סביר."
ptr_dvd,1689833454,39538,744,235,77,א. ישראל צריכה לעשות חשבון נפש איך אירע לה שבכירי משרתיה כל כך בורים ביחס למהי דמוקרטיה. אפשר להתחיל בהכשרות שהם מקבלים לאורך השירות - לדוג' במשך שנים סוזי נבות לימדה במכללה לביטחון לאומי בגלילות. ב. שימו לב שבשורות עובדי המדינה כמעט ואין דמוקרטים בעוד שבקרב הנבחרים יש להם רוב.
ptr_dvd,1689790171,4583,90,7,12,"עושים קצת סדר בבלאגן ובפייק. יו""ר תנועת 'ישראל שלי', ,⁩ משוחחת עם עבדכם הנאמן על מה שבוער. השאלות, התשובות, הפייק - והאמת. שביתת הר""י - חלק #1"
ptr_dvd,1689694061,6983,227,9,35,"מדווחים על מפגין שאיים בהנחת מטען חבלה בסניף של הרבנות. ההסתה כבר הובילה ב2020 אדם בשם ציון כהן, חבר קיבוץ מרום גולן, להניח מטעני חבלה בסניפים של הרבנות. כמה מכם מכירים את הסיפור על הטרוריסט המקומי הזה? התקשורת בחרה למסגר את העניין כקוריוז בעמודים האחוריים. זה לא היה מספיק חשוב."
ptr_dvd,1689692335,1639,59,1,3,"כל העילות המתוארות בספרים אלו נותרות על כנן. וטוב שכך. וחשוב שכך! אך לא ניתן להסכים להפעלת כוח שלטונית (במקרה זה, ע""י הרשות השופטת) באופן שרירותי. וזו עילת הסבירות הרחבה - כאשר הכל תקין מבחינה משפטית ואעפ""כ השופט מתערב. באיזה מובן זה בכלל אקט שיפוטי? באיזה מובן זה 'משפט'?"
ptr_dvd,1689687802,2594,129,6,9,רוצו לקרוא את הטור שפרסמתי ב. מרוב סערה ציבורית - שכחנו את היסודות.
ptr_dvd,1689520724,17173,430,28,54,"2 נק' שכולם מפספסים: א. עילת הסבירות היא הפעלת כוח שרירותית של רשות מרשויות המדינה (השופטת), והיא פוגעת בזכויות הפוליטיות של האזרחים (שמנסים לממש מדיניות ע""י נבחריהם). לכן היא חייבת הסמכה חוקית מפורשת ולהיות מידתית. הכללים שחלים על יתר הרשויות חלים גם על הרשות השופטת. &gt;&gt;&gt;"
ptr_dvd,1689328176,6041,262,29,14,"בהונגרית אומרים ""פשיזמוש"". זה תמיד צילצל לי חמוד מדי ביחס למה שזה. עכשיו אני מבין שזה מתאים בול. זה פשוט נורא קוסם לאנשים."
ptr_dvd,1689262727,19627,481,15,71,"בהתנתקות: ""בעבירות המבוצעות על רקע אידאולוגי אין חלופת מעצר שתאיין את המסוכנות"". היום: ""אין לנתק את המעשים מהרקע לביצועם. מעשי המשיבים אינם מלמדים על מסוכנות""."
ptr_dvd,1689251351,12538,518,42,29,קורה לאחרונה שאייטמים בתקשורת מתבטלים מהסיבה הזו. מה יש לפחד? אני בגדול בחור נחמד.
ptr_dvd,1689229564,6718,168,6,11,"אני משער שלבן כספית יש דרך משלו לומר ""סליחה, טעיתי"". שימו לב שעל הדרך הוא הוסיף אי-דיוקים חדשים: א. תרחישי האימים כאילו אם עובד זר לא הספיק לצאת מהארץ כי היה מאושפז ואז לוקחים לו את כל כספו מתעלמים לחלוטין מסעיף 8(ב) לתקנות שמסדיר פטור מניכוי הכספים בדיוק עבור מצבים אלו. ואם פסק הדין מתאר מקרה מסוים שבו זה לא קרה זו תקלה מנהלתית. כמו החלטה אטומה של ביטוח לאומי. זה לא קשור לשאלה החוקתית או לביטול חקיקה. ב. מוזמנים לעיין בטבלה המצ""ב מתוך מחקר שערכתי כדי להיווכח עד כמה החוק בכלל לא יושם והמדינה כמעט ולא ביצעה ניכויים. ג. העמדות של בן ביחס לחוק הרצוי לגיטימיות. אבל המחוקק הכריע אחרת. הדיון הוא מהי ההצדקה של ביהמ""ש לפסול את החוק. וכפי שאמר נכון הש' סולברג - אין שום הצדקה שכזו. ד. ההנחה שמספיק לאותת ""הם רשעים"" (ועוד לא לדייק ביחס למיהם ה""הם"") וכך לוותר על העמקה ודיון רציני - היא הנחה אנטי-עיתונאית ואנטי-אינטלקטואלית. ה. למרות הכל - קריטי להמשיך ולקיים דיון ענייני ויהי מה. זה המצפן, זה הנתיב. יום מוצלח."
ptr_dvd,1689223730,1814,60,1,2,"הצגתי בכנסת את ממצאי המחקר שלי וכן את המשמעויות שלו אך לפני מספר שבועות: מי מבינינו מבין על מה הוא מדבר ומי ""מסתער"" כלשונו של כספית? האמת? וואלה, לא מתאים. אפשר לחלוק, אפשר לכעוס על קידום מדיניות שאתה לא אוהב - אבל יש ערך לאמת ולענייניות."
ptr_dvd,1689223729,1014,58,1,0,"אציין שאני הייתי הראשון בטוויטר שהוציא התייחסות מקיפה ורצינית לפסה""ד. אבל חשוב מכך בהרבה - במחקר שפרסמתי בקהלת ב2021 יש פרק ייעודי רק על ההסדר החוקי הזה, על משמעויותיו ובעיקר על תת-היישום שלו לאחר שהצלחתי להשיג מסמכים בלעדיים עם נתונים רלוונטיים. &gt;&gt;&gt;"
ptr_dvd,1689187030,4957,129,14,11,מוזמנים בחום לצפות בדבריי באולפן בעניין עילת הסבירות. על הדרך תזכו לשמוע גם את פרופ' יואב דותן.
ptr_dvd,1689169251,354,13,2,0,מומלץ להכיר את הסוגיה לפני שמגיבים בכזו תקיפות. ראה ס' 8(ב) לתקנות.
ptr_dvd,1689156368,4103,150,9,29,"קראו את דבריו המלאים של כבוד הש' סולברג (מצ""ב קטע חשוב). ""היעלה על הדעת כי ביהמ""ש יתן ידו להפרה מודעת ומכוונת של החוק... האם עתירות לבית משפט זה... נועדו לשמש מטריית מגן לעוברים על החוק?"""
ptr_dvd,1689143396,22137,552,31,62,"חשבתי שהז'אנר של וואו מה פרידמן כתב על ישראל התיישן לפני 15 שנה או לכל הפחות אחרי שהוא קרא לפלסטינים פשוט לקום ולצעוד באלפיהם לירושלים. אבל שימו לב למה שהוא כותב הפעם על השומרון. פרידמן מצליף: בחוק ביטול ההתנתקות מצפון השומרון ישראל הפרה את הבטחותיה לנשיא בוש! אפשר להתווכח על ההגיון האסטרטגי בנסיגה מרצועת עזה (במנותק מהאופן בו זה בוצע) אבל הריסת יישובי צפון השומרון הייתה איוולת מחפירה שעד היום אנחנו משלמים עליה ריבית מדממת. לא הייתה שום סיבה לפנות את היישובים הללו ולהרוס לתושבים את מפעל חייהם. אנחנו רואים היטב מה קורה בגיזרה הזו בהיעדר נוכחות יהודית. המבצע האחרון בג'נין, לא יהיה האחרון. מה היה הרציונל של שרון? שתמורת החרבת היישובים הללו ויצירת מרחב פלסטיני-יודנריין ישראל תקבל מכתב. זוכרים את מכתב בוש? בו ארה""ב ""התחייבה"" לתמוך בגושי ההתיישבות כבסיס להסדר עתידי. הימין זעם ואמר שלא מחריבים יישובים ומפרקים את המולדת על מכתב של הדוד מאמריקה. התקשורת בזה לימין האלרמיסטי שלא מבין מהי דיפלומטיה. ומה קרה? ברגע שאובמה עלה לשלטון הוא אפילו לא התעלם מהמכתב בדיפלומטיות אלא אמר בבירור על השולחן שהוא פשוט לא מחוייב לו. יותר מזה - היה שלב שאנשיו אמרו שהם 'לא מוצאים' את המכתב. עד כדי כך הושפלה ישראל. ועכשיו בא פרידמן ואומר שישראל 'מפרה' את ההתחייבויות לבוש? כמה חוצפה, כמה שיטנה וכמה ציניות צריך אדם כדי לכתוב דבר כזה? פינוי צפון השומרון תמורת מכתב הייתה צריכה להיחקק בישראל כזיכרון מדמם וטראומטי. אבל התקשורת פה עסוקה בסגידה פרובינציאלית לפרידמן האוהב ישראל מהניו-יורק טיימס ירום הודו."
ptr_dvd,1688897382,3845,135,11,5,בסביבה של ריבית נוסקת להשאיר את אשתי היקרה בלי משכנתא זה רעיון
ptr_dvd,1688885600,2266,103,1,6,"זה אירוע טרגי של אוטיסט שנורה למוות אבל האמת צריכה להיאמר בצורה חדה - מבחינה משפטית זה אירוע מאוד פשוט. זוהי ""הגנה עצמית מדומה"". שילוב של טעות במצב דברים והגנה עצמית. הנמקה בהירה לגמרי של השופטת. למעשה זה כל כך ברור שזה משונה ביותר שהוגש כאן כתב אישום מלכתחילה. &gt;&gt;&gt;"
ptr_dvd,1688885599,1880,94,1,6,"השוטר פורץ פנימה ויורה כדור לפלג גוף תחתון. מי שבעיני השוטר הוא מחבל שוכב כעת פצוע ירי בחדר האשפה. לאחר מכן ה""מחבל"" מתרומם עם פלג גופו העליון ועושה תנועה פתאומית בידו בצורה שיצרה חשש לשליפת נשק. כאן איאד אל-חלאק נורה למוות. &gt;&gt;&gt;"
ptr_dvd,1688885598,25784,820,26,78,"מדוע כולם שותקים מול המתקפות הפרועות על הש' לומפ שזיכתה את השוטר שירה באל-חלאק? מפחידה המהירות שבה רבים מתנפלים על שופטת תוך שימוש ברמיזות להיותה דתיה בדרגות שונות של שנאה. מה הקשר של אימו האומללה של המנוח להפגנות? מישהו טרח לקרוא את פסה""ד או להצביע על פגם בהנמקה? בואו נתעמק. &gt;&gt;&gt;"
ptr_dvd,1695833368,14127,273,37,7,"סתם שאלה, למה השיח הזה מנורמל כאן?"
ptr_dvd,1695318925,1628,76,10,1,לאן הולך בעצם כל הכסף הזה שיאיא מגייס כל כמה חודשים?
ptr_dvd,1695219083,3427,77,6,0,אנחנו בחיים בקרקס רק בלי לולייניות בטייץ שעפות בשמיים
ptr_dvd,1694148414,8282,395,19,38,איך אוהבים להגיד בשמאל האמריקאי? Speak truth to power!
ptr_dvd,1689775900,5579,276,32,19,"- לא בשביל זה ההורים שלי הקימו את המדינה - זו דיקטטורה! אבל ההורים שלך הקימו מדינה שהמשיכה את המודל הבריטי בלי חוקה, בלי משקל מחייב ליועמ""ש, עם מינוי שופטים באמצעות מועמד של הממשלה ואישור במליאת הכנסת ובלי סבירות רחבה. למה ההורים שלך הקימו דיקטטורה? - דמגוג!"
SagiBarmak,1689364658,17607,239,35,4,"עילת הסבירות הורחבה על ידי בית המשפט בהסכמה רחבה? הייתה הסכמה רחבה בנוגע להפיכת חוות הדעת של היועץ המשפטי לממשלה למחייבת? זכות העמידה הורחבה בהסכמה רחבה? חביבי, *אתם* שיניתם את השיטה בלי הסכמה רחבה. אגב, מה נראה לך יעשו משרתי המילואים מהימין כמוני אם הטייסים יורידו את הממשלה על…"
SagiBarmak,1691670841,99785,631,164,37,אני מבין שהמחאה נכנסה לשלב המקארתיזם. שאולי שארף הוא בחור מבריק. מרצה אצלנו בתכנית אקסודוס. הפסד ענק לתלמידים ובושה גדולה לבית הספר.
SagiBarmak,1695204439,12026,225,19,7,"אחרי שניגבו את הרצפה עם טל רוסו, עכשיו מגיע תורו של בני גנץ לקבל טיפול דומה. בסוף, בישראל אין אופוזיציה פרלמנטרית אלא אוסף יוצא-דופן של בריונים, יאיא פינקים למיניהם ומילואימניקים בגיל פרישה שחושבים שיש להם זכויות יתר. שקיעתה של האופוזיציה המפלגתית."
SagiBarmak,1692091628,10649,91,51,2,"שלושה שינויים דמוקרטיים חשובים שניתן לגבש סביבם הסכמה רחבה בקלות יחסית: 1. הכנסת לא תפסול מפלגות על רקע תוכני-מהותי. במילים אחרות: חופש כניסה מוחלט לשוק הפוליטי. 2. הורדת אחוז החסימה לשם הגדלת ייצוגיות הכנסת. 3. מתן הגנות חוקיות לזכויות האזרח הבאות: הזכות לבחור ולהיבחר, חופש…"
SagiBarmak,1690098245,27264,352,76,35,הטיעון הכי טוב ששמעתי בזכות מלוכה בחסד האל.
SagiBarmak,1695017876,6294,174,44,1,המטורללים האלה זוכים למכובדות ציבורית ותקשורתית ולחיבוק מהאופוזיציה. זמנים עצובים.
SagiBarmak,1694100866,30885,1406,254,3,"אבי האהוב הלך עתה לעולמו לאחר מאבק עיקש במחלת הסרטן, כשהוא לצד משפחתו. איבדתי אבא יוצא דופן שאין כדוגמתו. תנוח בשלום על משכבך אבא יקר."
SagiBarmak,1696668200,6831,177,20,3,"תחשוב שבהערכת המצב ביום ראשון ישב הרמטכל, ראש השבכ והמזכיר הצבאי ואמרו כולם שחמאס מורתע ושיש להימנע מפרובוקציות. האחריות בהחלט מוטלת על הממשלה- ועוד נבוא איתה בחשבון. אבל הטנטרום שלך ושל אחרים הוא חרפה מדהימה."
SagiBarmak,1691680931,51980,601,107,69,"רון דיסנטיס, מושל פלורידה, פיטר היום את פרקליטת המדינה. הסיבה? החלטות שאינן עולות בקנה אחד עם המדיניות שהוא מתעקש להתוות כמושל: יד קשה כלפי פושעים. מסתבר שחוקת פלורידה לא שמעה על דוקטרינת ""שומרי הסף"". שימו לב ללשון החוקה בציוץ העוקב 👇"
SagiBarmak,1689691812,655,26,2,0,"בהחלט, רק לא ברור לי למה לא הפגנת על זה בזמן ממשלת השינוי? או למה אתה מפגין ברכבת תל אביב ולא בבני ברק או מאה שערים?"
SagiBarmak,1690794624,2112,111,3,14,"""אינני שמח על חדירת הפוליטיקה אל תוך הליך מינוי השופטים בארצי. אולם בכנות, אני מעדיף את זה על החלופה שהיא שלטון אריסטקרטיה שיפוטית"". אנטונין סקטליה. (מתוך: ""שופטים ככוהני דת"") 👇"
SagiBarmak,1696325007,5413,77,2,2,למה רק לירוק? אולי נכה אותם? נגרש אותם מהארץ? נשעבד אותם? לא מתאים לך לגלות כזו חלביות. אולי זה בהשפעת התרבות המערבית...
SagiBarmak,1690794815,3283,48,6,1,מישהו מדמיין לעצמו שתחת ההסדר הקיים לבחירת שופטים בישראל שופט מן הסוג של סקאליה יוכל להתמנות לעליון שלא על דרך המקרה הקוסמי?
SagiBarmak,1693571438,13530,282,38,21,"אני בטוח ש- מכיר את הקביעה ""אין מיסוי ללא ייצוג"". אז הנה עוד קביעה שרצוי להכיר: ""אין ייצוג ללא בחירה"". אם הגברת מיארה רוצה ""לייצג את הציבור"" ולא את הלקוח שלה (הממשלה), היא צריכה לקבל לשם כך את הסכמת הציבור. היא מוזמנת להציב את עצמה לבחירה ולהפוך לנציגת ציבור."
SagiBarmak,1695641304,46292,507,249,37,"מעדכוני יום הכיפורים בתורת המדינה: ליברליזם זה כשאתה מחבל, משפיל, מקלל ומקטין יהודים אחרים שמבקשים - מרצונם החופשי ומבלי שפגעו בחיים, ברכוש או בחופש של אף אדם אחר- לקיים תפילה עם מחיצה בפרהסיה."
SagiBarmak,1688926899,31067,881,136,86,"חברים, אנחנו בעיצומה של פסיכוזה ציבורית חסרת תקדים. האליטה האינטלקטואלית, התקשורתית והתרבותית ועמה כל הצמרת הביטחונית בדימוס מנסה לשכנע את הציבור שאם דעתה של עורכת דין שמינתה האופוזיציה ושתפקידה בכלל לייעץ לא תהיה מחייבת- ישראל תחדל מלהיות דמוקרטיה. מה קורה כאן?"
SagiBarmak,1692452151,1614,110,2,2,"התכוונת למבוא ליוריסטוקרטיה. בספר הלימוד היוריסטוקרטי, בית המשפט העליון הוא האופוטרופוס של הכנסת שמבקר לא רק את חוקיה הרגילים אלא את חוקי היסוד עצמם וזאת ללא קיומה של אף סמכות שהעם העניק לו."
SagiBarmak,1690293911,12979,325,17,7,יהודי שירד מהארץ מגרש מהעסק שלו את שגרירה של מדינת היהודים שמונה לתפקידו על ידי ראש האופוזיציה. הגיוני בסך הכל.
SagiBarmak,1690658335,80650,509,88,19,שלום ליובל נח הררי. שיטת המשטר האמריקאית שאליה אתה משווה את זו הישראלית בבוז מופגן לא מנעה (בין היתר) את התופעות הבאות: 1. עבדות 2. סגרגציה גזעית 3. מלחמת אזרחים 4. אאוגניקה נרחבת 5. כליאה המונית של אזרחים ממוצא יפני 6. מקרתיזם 7. הכחדה של אוכלוסיה ילידית 8. הסתערות על הקפיטול…
SagiBarmak,1690531435,50891,326,71,37,עד למהפכה החוקתית התקיימה בישראל הפרדת רשויות מצויינת. הכנסת חוקקה. בית המשפט יישב סכסוכים בכפוף ובהתאם ללשון החוק. כל רשות ותכליתה. המהפכה החוקתית הראשונה היתה הפגיעה הראשונה בעקרון הפרדת הרשויות. לקחו בית משפט שנהנה מאמון ציבורי נרחב ושהצליח להעניק סעד ולהגן על זכויות והכניסו…
SagiBarmak,1695037818,30305,662,117,44,"אין פרה קדושה אחת שהמחאה הזו לא שחטה. אקדמיה, רפואה ציבורית, עבודה מאורגנת, צה""ל, תקשורת, יחסים בינלאומיים, מורשת בן-גוריון, מגילת העצמאות- תחום אחר תחום עבר פוליטיזציה בדורסנות מבהילה. סילופים, שקרים, נרטבים כוזבים וחשיבות עצמית מופרזת. מקווה שנתאושש מזה כחברה."
SagiBarmak,1695102564,5192,145,16,18,"מאמר מערכת מחמיא מאוד לנתניהו ומעניין מאוד הבוקר באופן כללי ב-WSJ. המאמר, שהולם את ההתבטאויות של נתניהו, מסמן למעשה את קו הסיום של האפיזודה כולה- שינוי בועדה לבחירת שופטים שימסד שוויון בין קואליציה לאופוזיציה. בלי שופטים. בלי נציגי לשכה. זו פסקת המפתח במאמר 👇"
SagiBarmak,1689403136,61714,727,179,79,"מסתבר שלממשלה שזכתה באמון הכנסת לאחר בחירות חופשיות אסור: 1. לצמצם את עילת הסבירות וזכות העמידה לאחר שבית משפט אקטיביסטי הרחיב אותן. 2. לבטל את הגרעון הדמוקרטי בועדה לבחירת שופטים לאחר שבית המשפט לקח לידיו את הכוח לבקר לא רק חקיקה ראשית אלא אף את חוקי יסוד. 3. לצמצם את הכוח של עורכת דין שחוות דעתה ושיקול דעתה הפכו למחייבים. הצעדים האלה, שלא נוגעים באף זכות פוליטית ובאף עקרון יסוד של הדמוקרטיה הפרלמנטרית שלנו, תוייגו כ""הפיכה שלטונית"". לא פחות. ומהרגע הזה כל מהלך קיבל הכשר- מהפוליטיזציה הגלויה של האקדמיה והתקשורת ועד לפגיעה בכשירות המבצעית של צה""ל. תסכול של מחנה שהפסיד בבחירות ושביצר את כוחו בבית המשפט יצא החוצה בהתקפה עזת מצח על הדמוקרטיה הפרלמנטרית."
SagiBarmak,1689407180,392,14,2,1,לא לומדים שם סבירות. יכול למנות את הקריטריונים האובייקטיבים למבחן סבירות?
SagiBarmak,1691610112,2546,191,7,5,"זה *לא* הסבר ממצה. למעשה, זה כלל לא הסבר. יניב יכול לטעון שלבית המשפט ""סמכות אינהרנטית"" עד מחר- על זה בדיוק הויכוח. מאיפה הסמכות הזו צצה? מי העניק אותה? למה יש לה תוקף? איך היא עולה בקנה אחד עם עקרונות הדמוקרטיה? כאמור, אין כאן אפילו התחלה של הסבר."
SagiBarmak,1689256762,3851,161,19,14,"אם בית המשפט יכול לקבוע שמי שעומד בראש מפלגה בינונית לא יכול לכהן כשר, למה שלא יקבע על הדרך שהעומד בראש המפלגה הגדולה ביותר לא יכול לכהן כראש ממשלה? אתם רואים פה איום על הדמוקרטיה. הם רואים כאן מבחני סבירות."
SagiBarmak,1696660877,18509,339,21,16,בהחלט. זה מסתמן כמו אירוע שמצדיק ועדת חקירה ממלכתית לצד השבה של המנדט לציבור. הייתי דורש את זה אם המחדל היה מתרחש תחת ממשלת שמאל. צריך לדרוש את זה גם כשהאירוע יסתיים.
