author_username,created_at,impression_count,like_count,reply_count,retweet_count,text,word_count
AmiadCohen,1692216571,650,18,4,0,"הם חושבים שזה שיכנע את שלושת החרדים שישבו באוטובוס להתגייס? ואם לא, אז מה הייתה המטרה?",16
AmiadCohen,1690127636,271,8,2,0,"לא הבנתי, אז יש חוקה או אין חוקה?",8
AmiadCohen,1696707410,0,0,0,41,RT : Get ready. Israel must take considerable territory in Gaza in order to win this. Victory cannot be had by airstrikes alo…,23
AmiadCohen,1696695026,0,0,0,18,"RT : Like in '73, this surprise attack on Israel seeks to deal a blow to Israel and simultaneously provoke great power action.…",23
AmiadCohen,1696528876,488,14,0,0,"אם תהיתם לעצמכם איך נשמעו הקולות הראשונים של מהפכת התרבות של מאו דזה דונג ב1966, אז ככה...",17
AmiadCohen,1696512422,368,5,0,0,"ב1215 חתם גון מלך אנגליה על כתב הזכויות המפורסם ביותר, וייתכן גם הראשון בהיסטוריה. מעבר להגבלת שלטון המלוכה, הוכרזו שם זכויות של נאשמים במשפט פלילי, והוגדרו מנגנונים שתפקידם למנוע תפירת אשמה שרירותית בידי בעלי הכח. No freeman shall be taken or [and] imprisoned or disseised or exiled or in any way destroyed, nor will we go upon him nor send upon him, except by the lawful judgment of his peers or [and] by the law of the land קשה להבין איך אנשים שטוענים שהם בעד זכויות אדם, וקוראים לעצמם ליברלים, תומכים בצורה כך כך בוטה בגזר הדין המוכתב מראש ללא קשר להליך השיפוטי ,ועוד חוגגים על זה. מה גם, שנראה שלילדים בתמונה חסרים קלשונות כדי להצטרף לתמונה של ציד מכשפות מימי הביניים. אנחנו חיים בתקופה נפלאה של בירור ערכים אמיתי. זה לא ליברליזם.",133
AmiadCohen,1696407239,6502,126,3,7,"הדס שטייף היא לא יותר מלוביסטית של החברים שלה במטרה לקבל מהם הדלפות בהמשך. בעיניה המועמדים למפכ״ל (הם ורק הם!): דורון תורג׳מן - עשה תפקיד ניצב אחד בלבד. אמיר כהן - מפקד מג״ב שמעולם לא היה שוטר כחול. חודש הוא מפקד מחוז וכבר שטייף רוצה אותו כמפכ״ל. כאילו קובי שבתאי אחד לא הספיק לנו. אבי ביטון - היה 5 חודשים ראש אגף ומאז הוא מפקד מחוז בינוני. רק לשם השוואה, ניצב (בדימוס) יורם הלוי הגיע לשלב המועמדות למפכ״ל אחרי 5 תפקידי ניצב. ומי שיגיד, מה זה כבר משנה מי המפכ״ל, שייזכר באסון מירון, בשומר החומות, באנרכיה אליה הגיעה החברה הערבית ושיקרא את המאמר שפרסמנו בנושא בשילוח.",106
AmiadCohen,1696318962,493,16,0,0,אירוע בקנה מדיה היסטורי מתרחש לנגד עינינו.,7
AmiadCohen,1696242092,488,12,0,1,"מצד אחד ממשלת ""ימין"" סוציאליסטית, מצד שני ממשלת שמאל פרוגרסיבי סוציאליסטי. 😭",12
AmiadCohen,1696238701,300,7,0,0,הוא שלם עם זה שלנבחרי ציבור לא יהיה כח.,9
AmiadCohen,1695822085,0,0,0,3,"RT : הוא לא צנוע חלילה, אבל בניגוד לפוליטיקאים בעבר ובהווה, תפקידו כעובד מדינה לא מאפשר לו לקפוץ קדימה ולקחת קרדיט. אלא שהקרדיט…",23
AmiadCohen,1695755659,584,13,1,3,"מעניין מה הוא חושב על אדם ששתק בחקירה בחשד להלבנת הון לשימוש כתרומות לקמפינים פוליטים בניגוד לחוק, ואז הפך למועמד לראשות ממשלה, וכיום משמש כנשיא המדינה.",26
AmiadCohen,1695679387,0,0,0,117,"RT : יום הכיפורים נמצא בקונצנזוס הישראלי: יום בו כל המגזרים שובתים מעבודה, מקניות ומנסיעות. תפילות החג הקהילתיות במרחב הפתוח -…",21
AmiadCohen,1695555495,326,4,0,0,יש קונספציה שכושלת ומובילה למלחמה. ויש קונספצית שכושלות ומביאות לשלום,10
AmiadCohen,1695550134,0,0,0,2,RT : נפתחה ההרשמה לתכניות ״חכמתכם ובינתכם״ לשנה״ל תשפ״ד לגברים ונשים בוגרי החינוך החרדי. הצטרפו אלינו לתוכנית עיונית בהגות ומד…,20
AmiadCohen,1695497949,1971,45,15,0,רק מי שמאמין במונרכיה שיפוטית פרוגרסיבית לא מקבל את התשובה של נתניהו.,12
AmiadCohen,1695382160,0,0,0,16,"RT : יופי של קטע. נ.ברמע מדווח מלוויתו של יגאל אלון ז""ל 1980. רק 3 שנים אחרי המהפך וכבר הזאב רזים למיניהם (בני ה30 וה40) מסתובבים עם…",27
AmiadCohen,1695366816,596,27,1,6,הסרטון הזה מזקק את הדמגוגיה של השמאל. אין שום טענה. או דוגמא רצינית רק סיסמאות חלולות,16
AmiadCohen,1695327890,268,2,1,0,"הלם, ניהול ריכוזי לא עובד, אגב, גם לא בשאר הכלכלה.",10
AmiadCohen,1695327160,2026,49,1,4,"לפעמים אני מדמיין את התגובות בימין ובשמאל אם המשא ומתן על הגבולות הימיים עם חיזבאללה היה מתנהל כשלפיד ראש ממשלה, וצוחק מלא ואז אני נזכר שזה מה שקרה, ובוכה.",29
AmiadCohen,1695326008,343,12,0,2,"לרגל 50 שנה לקונספציה שהובילה למלחמת יום כיפור, גיורא איילנד מוכיח שהקצונה הבכירה לא למדה כלום",16
AmiadCohen,1695296400,0,0,0,206,"RT : ""האופוזיציה מתנהלת בצורה מופקרת ולכן לא נביא את ההסכם להצבעה בכנסת""",13
AmiadCohen,1695219166,0,0,0,23,RT : בוחן מציאות נאה: אם אתה חושב שציבורים שלמים במדינת ישראל הם פשיסטים שצריך בשם הדמוקרטיה המתגוננת למנוע מהם זכויות פוליטיות…,22
AmiadCohen,1695158175,997,5,0,0,"החוק הזה משוגע. במקום לפשט את מערכת המס, מסרבלים אותה ומקשים על בעלי עסקים ליצור ערך אמיתי. הכיוון הנכון במס חברות צריך להיות אחוז מהכנסות. (בין אחוז ל2). במידה וזה חדשני מדי, אפשר להוריד מס חברות ל17% לכולם בלי הקלות מס וקומבינות, ולהשטיח את מס ההכנסה ומס רווחי הון גם ל17%. (אפשר להתחיל את מדרגת המס השולי מ10000 שח ברוטו ) השאלה היחידה שהממשלה צריכה לחשוב הוא מה מונע מהאזרחים ליזום וליצור ערך , ואז להסיר את המכשול. חוק כזה פועל הפוך ומייצר מכשול נוסף.",85
AmiadCohen,1695012748,0,0,0,9,RT : סטודנטים שנה א׳ למשפטים? זה בשבילכם,8
AmiadCohen,1694771485,0,0,0,14,"RT : לידיעת מאות אלפי חברי ומיוצגי ההסתדרות, ראש הארגון ש-""מייצג"" אתכם רואה בכם חיילים במאבק לביטול הדמוקרטיה הישראלית. לדברי…",20
AmiadCohen,1694712263,826,13,2,0,"תומאס סואל לא רק חכם. הוא בעיקר עם יושרה אינטלקטואלית ובהירות מחשבתית, שהופכת את הקריאה בספרים שלו והאזנה להרצאות שלו לקולחת וכיפית.",22
AmiadCohen,1694711843,385,3,0,0,"הרעיון של מנגנון בקרה על חקיקה אינו חדש. ישנה אפשרות להשאיר את בקרת החקיקה אצל 15 משפטנים נאורים שנבחרים על ידי ועדה סודית מתוך רשימה סגורה של אנשים. האפשרות השניה, היא העברת מנגנון הבקרה אל נציגי ציבור שמערכץ התמריצים שלהם שונה משל המחוקק. לקראת סוף במאמר המצורף, מציע מודל מעניין של הקמת בית נבחרים שני שיהווה בלם לחקיקה קצרת רואי. למי שמעוניין בפתרונות יצירתיים, ולא בשימור כח אצל גילדה משפטית, אני ממליץ בחום לקרוא את כל המאמר.",77
AmiadCohen,1694696089,1,0,0,1,"RT : רוצים להבין טוב יותר את הסוגיות שבלב הדיונים בבית המשפט העליון? אנחנו מזמין אתכם להתעמק במגוון חומרים מתוך הספרייה, הב…",22
AmiadCohen,1694693995,0,0,0,1,"RT : ממה נפשך - אם אין דבר מיוחד בחוקי היסוד, חוק יסוד כבוד אדם וחרותו לא יכול להיות הבסיס לביקורת השיפו…",22
AmiadCohen,1694597099,0,0,0,3,RT : מתחילים שנה א׳ במשפטים? רוצים להצטיין בתואר? הצטרפו אלינו לסדנת הכנה ללימודי משפטים! בואו ללמוד מושגי יסוד בעולם המשפט…,21
AmiadCohen,1694548261,0,0,0,210,"RT : לא זה לא שמחה רוטמן, זה ראש ממשלת ישראל לפני 11 חודשים נושא נאום תמיכה ברפורמה המשפטית. נאום שלא זכה לחשיפה גדולה במיוחד (2…",26
AmiadCohen,1694547203,188,2,0,0,"ממליץ לכל ""תומכי מגילת העצמאות כסמכות מכוננת "", לקרוא את הספר הזה, ולהבין באמת על מה הם מדברים",18
AmiadCohen,1694127898,0,0,0,611,"RT : רות גביזון ז""ל מסבירה לאהרון לברק מהי דמוקרטיה תודה ל 💛",13
AmiadCohen,1694085090,552,21,0,0,"הוד רוממותה, מנהיגת המשפט העליון, שמש העמים, לא מושפעת מדעתה האישית",11
AmiadCohen,1694041505,0,0,0,23,RT : פרופ' נדב שנרב סבור שבתגובה לביקורת שיפוטית של בית המשפט העליון על חוקי יסוד יש להתקדם להתנגשות רשויות באופן חזיתי ככל הנ…,24
AmiadCohen,1694017718,249,5,0,0,הדבר היחיד שחשוב מול החרדים זה הורדת גיל הפטור ל21. כל פשרה אחרת היא בכייה לדורות,16
AmiadCohen,1694010466,446,15,3,0,"ברייטמן יודע שהוא לא שכנע אף אחד ללמוד ליבה בציוץ הזה. אבל כשהאישי הוא הפוליטי, אין צלם אנוש, אין בני אדם. ובשם האידאולוגיה המופשטת שלו הוא מרגיש חובה להשפיל מישהו, כדי שהחרדים האלה ילמדו לקח. בחילה",36
AmiadCohen,1694009553,0,0,0,111,RT : This is the true face of Palestinian “leadership”. It is no wonder that mere hours ago a Palestinian teenage terrorist hac…,23
AmiadCohen,1693932044,521,13,0,0,"מסתבר שמיראלשווילי מסייע כספית לעובדים קשי יום כדי שיוכלו לנוח ביום המנוחה החוקי של מדינת ישראל, ולבלות עם הילדים שלהם ובחיק משפחתם. ראוי",23
AmiadCohen,1693929926,0,0,0,80,"RT : שימו לב לקטע הבא - אהרן ברק מפלרטט עם הרעיון להורות לכנסת מה לחוקק. [מתוך ""עושה הכובעים - דין ודברים עם אהרן ברק"", 2009]. http…",27
AmiadCohen,1693830567,0,0,0,21,RT : אמציה שאל שאלה פשוטה ותמימה. חוסר היכולת לספק לו תשובה עניינית פשוט מהמם. קריאת חובה.,17
AmiadCohen,1693825648,0,0,0,61,"RT : מאחורי הפילפולים המשפטיים של גלי בהרב מיארה, התומכת בביטול חוק יסוד, מסתתר מסר ברוטאלי לאזרחי ישראל: הדמוקרטיה שלכם סיימה…",21
AmiadCohen,1693754822,0,0,0,18,"RT : I am proud to present ""The Peculiar Case of the Israeli Legal System"", my new essay detailing ten major flaws of the Isr…",25
AmiadCohen,1693745139,0,0,0,44,"RT : לאחרונה התפרסם כי השר לענייני ירושלים ומסורת ישראל, מאיר פרוש, פעל מול שלטונות אוקראינה עבור עבריין המין המורשע אליעזר בר…",22
AmiadCohen,1693745093,0,0,0,1,RT : האם בעולם הציני שלנו עוד נותרה בנו רגישות טראגית? האם עודנו מסוגלים לדמוע כשאנו קוראים את המלט? הצטרפו לשיחה בין מתנאל ב…,24
AmiadCohen,1693683588,0,0,0,163,"RT : קצת באטרף כרגע מכל הפניות, עמכם הסליחה. על רגל אחת, בסוגיה הזו אפשר לומר חד משמעית שהממשלות עשו *כמעט* את המקסימום שביר…",24
AmiadCohen,1693678715,0,0,0,40,"RT : ""אבל למה אתם מאשימים את בג""צ שביטל את ההחזרה חמה ואת גדרה חדרה וסיכל את המדינה השלישית ושלושה חוקים נגד הסתננות ואת חוק הפי…",26
AmiadCohen,1693558232,0,0,0,1,"RT : מאמר הביקורת שלי על תזת ה""רודנות בחסות החוק"" עלה עתה לאתר השילוח והוא זמין לקריאה אונליין והורדה. קישור 👇",21
AmiadCohen,1693405948,249,9,0,0,שמעתי שאהרון ברק מיחס סגולות פלא חוקתיות למגילת העצמאות. אני ממליץ בחום לקרוא את הסיפור המלא של ניסוח מגילת העצמאות ולהחליט בעצמכם האם הוא המסמך המכונן של המדינה ומה חשבו מנסחיו על הגבלת הרשות המחוקקת והמבצעת,36
AmiadCohen,1693138627,0,0,0,3,RT : סמינר הקיץ של הפורום הישראלי למשפט וחירות - התחלנו! פתחנו את הבוקר הראשון של הסמינר במטרה להבין טוב יותר את מעלותיה של…,24
AmiadCohen,1692963008,0,0,0,26,RT : 155 החלטות בנוגע לתיקוני חוקה! מדהים! * 30% שפסלו; ** 86% מאלו שפסלו התבססו על סעיפי נצחיות בחוקה שחוקקו על ידי הריבון; ***…,25
AmiadCohen,1692811562,0,0,0,2,RT : אז פוטין כן בחר בקו העלילתי הזה? 🤔,10
AmiadCohen,1692726058,0,0,0,12,"RT : לא היינו משלימים עם הפקרות שכזו בתל-אביב, חיפה או אשדוד. באופן דומה אנחנו לא צריכים להשלים עם אנרכיה בסכנין, אבו-סנאן או טי…",24
AmiadCohen,1692689056,0,0,0,15,"RT : יש משהו משעשע בכך שאותם אנשים שלא סומכים על רוב פשוט או מוחלט בבית הנבחרים כן סומכים על רוב פשוט בבית המשפט העליון. איכשהו,…",26
AmiadCohen,1692190811,0,0,0,381,"RT : המילארדר קובי ריכטר, מקורבו של אהוד ברק, הסביר לשלום קיטל ברדיו כיצד תנצח האליטה את הממשלה: כי ""הכוח הביטחוני הוא אנחנו, המו…",24
AmiadCohen,1691663463,0,0,0,17,"RT : תזכורת: מעל לחוקי היסוד אין חוקים. יש נורמות, ערכים, עקרונות ואידיאות, אבל חוקים אין. דעתם של שופטים על מה שאינו חוק יכולה…",24
AmiadCohen,1691609701,546,20,0,2,"היה צריך להגיב ככה כבר בחוק הלאום, אבל לא מאוחר לתקן",11
AmiadCohen,1691596533,0,0,0,1,"RT : תכנית אקסודוס מגיעה להרצליה! תכנית אקסודוס ליסודות המחשבה הליברלית הקלאסית מיועדת לתלמידים מצטיינים לתואר ראשון, וכוללת…",18
AmiadCohen,1691521538,0,0,0,61,RT : כרוניקה של השחתה אנטי-דמוקרטית בארבע תחנות: תחנה 1. בספרו הקלאסי 'חוקת החירות' הסביר פרידריך האייק את הסכנה הנשקפת לחירות…,21
AmiadCohen,1691497996,424,18,0,0,"ברור שלבג""ץ אסור להתערב. ומי שיהדותה של המדינה חשוב לו שישכנע את הציבור ולא 15 שופטים. וכן, גם אם יום אחד יהיה רוב ערבי במדינה, שיחליט לחוקק שהמדינה היא ערבית, לבג""ץ יהיה אסור להתערב. הציבור הוא הריבון היחיד לגורלו, והחלטות ערכיות ותרבותיות נקבעות אצלו ואצל נציגיו בפרלמנט.",47
AmiadCohen,1691078945,375,16,0,0,אולי רונן צור יואיל בטובו להצביע על הסעיף בחוק הישראלי המאפשר לבית המשפט העליון לפסול חוק יסוד?,17
AmiadCohen,1691061076,454,11,0,3,"*""המלצת קריאה וצפייה""* הפורום הישראלי למשפט וחירות מזמין את הקהל להתרשם ממאמרים וסרטונים שפורסמו בבלוג רשות הרבים ובספריית הסרטונים של הפורום שעוסקים בנושא *ביקורת שיפוטית על חוקי יסוד*: *פרופ' רות גביזון ""האם העליון רשאי לפסול חוקי יסוד?""*. לקריאה: *פרופ' ג'רמי וולדרון ""ליבת הטיעון נגד ביקורת שיפוטית""*. לקריאה: *פרופ' דניאל פרידמן ""הרצאה בנושא תיקון חוקתי לא חוקתי: אקטיביזם שיפוטי של פסילת חוקי יסוד""*. לצפייה: *ד""ר שגיא ברמק ""עקרון עליונות הכנסת כעקרון יסוד בשיטת המשטר הישראלית""*. לקריאה: *פרופ׳ יניב רוזנאי וד״ר אביעד בקשי ""דייביט ביקורת חוקתית על חוקי יסוד""*. לצפייה: *עו""ד משה יפה ""ביקורת על ביקורת שיפוטית על חקיקת יסוד – בעקבות בג”ץ שפיר""*. לקריאה: *פרופ' גדעון ספיר ""הגבלת הסמכות המכוננת – בעקבות בג”ץ שפיר נ’ הכנסת""*. לצפייה:",116
AmiadCohen,1691052942,455,22,2,2,באיזה סעיף בספר החוקים של מדינת ישראל זה מפורש?,9
AmiadCohen,1691047033,902,70,1,9,"היום, שופטים שלא נבחרו על ידי הציבור, הולכים לדון, האם פקידה, שלא נבחרה על ידי הציבור, יכולה לפטר באופן שרירותי ראש ממשלה, שכן נבחר על ידי הציבור. וכל זה בקריאות רקע קצובות ואחידות של דמו-קרט-יה. אפילו גורג אורוול לא הצליח להמציא את זה",43
AmiadCohen,1690987256,255,7,0,0,"אני ממליץ לקרוא את חוות הדעת של המכון הישראלי לדמוקרטיה בעניין חוק הנבצרות. קשה שלא להתפעם מהמעבר שלהם מ""שלטון בהסכמת הנמשלים"" ל""שלטון בהסכמת היועמ""ש""",24
AmiadCohen,1690959852,2811,43,6,3,"זה אמנם נתון אנקדוטאלי, אבל מי שמעורב במגזר החרדי, ובעיקר מתחת לגיל 30 רואה שינוי גישה עמוק מאד. את התוצאות המלאות נראה רק בעוד דור, אבל תהליך הדרגתי של ""ישראליזציה"" מתרחש בחלקים נרחבים של המגזר החרדי . נכון, לצערי זה לא יסתיים בגיוס לצבא, בוודאי לא בשלבים הראשונים, אבל ההזדהות עם המדינה, החיבור לשוק התעסוקה החיכוך עם אוכלוסיה ותרבות ישראלית, בעיקר דרך האינטרנט, משנה את היחס לחברה הישראלית. הם כנראה ישארו דתיים, ולדעתי הם ישארו חרדים, אבל הזהות החרדית תהיה יותר פוזיטיבית, ופחות שלילת הזהות הלאומית. המשמעות העיקרית היא שצריך פחות לאיים, פחות לייצר קונפליקט, להעביר אליהם יותר את מחיר הבחירות שלהם על ידי צמצום הדרגתי של מדיניות הרווחה הנדיבה. בנוסף צריך להבין שאין ""שלום עכשיו"" ואין ""גיוס עכשיו"" לחרדים. אלו תהליכים שיקחו זמן, אבל המגמה החיובית קיימת למרות שמן הסתם יהיו נסיגות כאלה ואחרות. אנחנו צריכים פשוט לא להפריע.",140
AmiadCohen,1690918118,640,17,1,0,"אקדמיה רצינית היתה חוקרת את אבדן הדעת של התקשורת הישראלית. פעם הם היו מנסים לייצר מצג מסוים של אוביקטיביות, שלעובדות יש משמעות. בחצי שנה האחרונה הם פשוט הפכו לשחקן פוליטי על מלא.",32
AmiadCohen,1690904220,0,0,0,4,RT : אם העניין הזה אמיתי אז הוא חשוב לרמת החיים שלכם בסדרי גודל יותר מהרפורמה המשפטית ושאר כשלי הממשלה והוויכוחים שרצים כאן.,23
AmiadCohen,1690894179,0,0,0,287,RT : פרופ’ סטיבן קלברזי (Calabresi) מציע להוציא את 3 השופטים מהוועדה לבחירת שופטים בישראל בשל ניגוד עניינים. צפו בקטע מהשי…,21
AmiadCohen,1690534787,479,16,0,0,"הפרשן הפוליטי, בני גנץ מדבר כל כך יפה על חשיבות הפשרה והאחדות. לו רק היה מנהיג באופוזיציה שחצי מהמפלגה שלו קידמה בעבר את הרפורמה, ושהיה יכול להשתלב בקואליציה או לפחות להגיע להסכמות עם הקואליציה על הרפורמה הנדרשת, בשם האחדות ולטובת המדינה. לו היה מנהיג כזה ודאי הוא היה מגיש את המתווה שלו לרפורמה, והיה מקדם דיון מעמיק על השינויים הנדרשים במבנה החוקתי. לו היה מנהיג כזה, הוא היה יוצא בחריפות נגד כל ניסיון לפרק את צהל ולפגוע בכוונה בכלכלה. לו היה מנהיג כזה, הוא היה נכנס לחדרו של נתניהו ולא יוצא עד שמגיע להסכמה מלאה על מתווה מוסכם. אבל אין לנו מנהחג כזה, יש לנו פרשן פוליטי.",107
AmiadCohen,1690476656,512,25,1,2,השופט כבוב בניסוח מדויק מדוע על בית המשפט לפסוק על פי חוק ולא על פי מה שבא לו.,18
AmiadCohen,1690374957,0,0,0,321,RT : My interview today on CNN about the judicial reform הראיון שקיימתי מוקדם יותר היום לרשת CNN בנושא הרפורמה המשפטית&gt;&gt;&gt; https:…,22
AmiadCohen,1690352758,0,0,0,439,"RT : אני אליהו בֵּהְרוּז יוסיאן בוגר 8200 וזוכה יחד עם צוות בפרס ביטחון ישראל מטעם נשיא המדינה. איש ימין, קפיטליסט ותומך מובהק ב…",24
AmiadCohen,1690185188,207,2,0,0,עתידות: ישראל תישאר במקום הרביעי גם בשנה הבאה,8
AmiadCohen,1690101788,2865,68,2,5,"""שופט עליון...אין כסא יותר גבוה ממנו על פני האדמה...אין לו לאן לשאוף...אין לו אינטרס מידי...לא מעניין אותו להיבחר...אתה לא חייב דין וחשבון לאף אחד חוץ מלמצפון שלך ולאמת הפנימית שלך... אז אני אלך לבן אדם הזה או לפוליטיקאי שיש לו אינסוף אינטרסים??""",42
AmiadCohen,1689842777,0,0,0,156,"RT : גם קישון לא היה יכול להמציא דיון משפטי בנושא ניגוד עניינים של ראש ממשלה נבחר, בטענה שהוא עוסק ברפורמה המשפטית (שזו לא רק סמכ…",26
AmiadCohen,1689794471,306,18,0,1,מועצת החכמים העליונה תדון האם תוצאות הבחירות ראויות בעיניהם דמוקרטיה אומרים לכם...,12
AmiadCohen,1689791982,0,0,0,3,"RT : הערב במכון ארגמן: ד״ר היישר מאוני׳ פרינסטון, בהרצאה על השורשים התיאולוגיים של הWOKE. בהנחיית ליאור אבוטבול -…",19
AmiadCohen,1689672167,613,22,2,1,"לא מצליח למצוא את העקרון הליברלי שתומכי החירות דה לא שמעטא כמו רוזנאי מאמינים בה, שמצדיק ששתי תחנות הרדיו החזקות במדינה יהיו ממשלתיות ואחת מהן שייכת בכלל לצבא. ליברל אמיתי היה טוען שצריך לסגור אותה.",35
AmiadCohen,1689621607,0,0,0,126,"RT : בזכות שלמה קרעי, גם אתה תוכל להיות טייקון תקשורת! בקרוב יגיע הסוף לדואופול של צה""ל והמדינה על הרדיו. גם אזרח רגיל, בלי קומ…",25
AmiadCohen,1689516197,490,13,2,1,"הלם!! מדינת ישראל הפסידה 20,000,000,000 ש""ח בגלל ב""מחיר למשתכן"" הפעלה: מה אפשר היה לעשות עם סכום כזה במקום לסבסד את עשירי ישראל ולהעלות את מחירי הנדלן?",26
