author_username,created_at,impression_count,like_count,reply_count,retweet_count,text
SagiBarmak,1690118572,1574,48,1,1,"אוי זה נחמד. יצא לי להציץ היום בהמלצות המדיניות שפרסם ""פרוייקט הכוח השיפוטי"" בבריטניה, התארגנות של משפטנים שמרנים בכירים ששמה לעצמה למטרה לבלום את עלייתו העקבית והמתמשכת של האקטיביזם המשפטי באי. אצלנו תייגו צעדים זהים כ""רודנות בחסות החוק"". https://t.co/Qr4FW4NUob"
SagiBarmak,1690054769,5506,185,18,7,"""אין הסבר אחר"", ""קיסר שנמצא מעל החוק"", מקווה שיוציאו ראש ממשלה שזכה לאמון מהכנסת לנבצרות ואף למשבר חוקתי. פנינים. https://t.co/Gc9YhNwMwo"
SagiBarmak,1689948167,471,23,1,0,@roznaiy @OrenNahari איפה הקריאות לפוטש של גנרלים משתלבות באיור? https://t.co/Emk4besz4a
SagiBarmak,1689948125,2432,100,8,2,יאיר גולן צדק. גם אני מזהה תהליכים. https://t.co/0VxhOEjPR6
SagiBarmak,1689919374,3555,106,12,7,"לא, *אין* בעיה בעקרון הפרדת הרשויות בישראל. הממשלה *לא* שולטת בכנסת. אין בישראל רק שתי רשויות. הממשלה *כן* מובילה חקיקה- בדיוק כמו כל ממשלה אחרת בדמוקרטיה פרלמנטרית. רוצים עוד על עקרון הפרדת הרשויות ועל היישום שלו בשיטה הישראלית? קראו את המאמר של גיל ברינגר. https://t.co/13msicZGvv"
SagiBarmak,1689877651,4631,176,8,7,זה משתפר מרגע לרגע. https://t.co/8ob1dMC4bK
SagiBarmak,1689870528,3215,247,12,8,הבנתם? הביקורת על הטייסים מחוללת נזק גדול.  אי-אפשר להמציא דברים כאלה. https://t.co/BiQ6p38kvG
SagiBarmak,1689752485,5214,210,20,7,ניחוחות של פוטש על הבוקר. https://t.co/atG5FlTioG
SagiBarmak,1689702397,35993,377,143,32,"שימו לב: הם מוכנים לפגוע בכשירות המבצעית של הצבא, ליצור תקדים הרסני שיאפשר לכל קליקה צבאית להוריד לברכיים ממשל נבחר עקב כל צעד שנוי במחלוקת ולהפוך את ישראל לגרסה מקומית של טורקיה בגלל ביטול עילת הסבירות ומיסוד של שוויון בין קואליציה לאופוזיציה בועדה לבחירת שופטים. אם הממשלה תכנע לסחיטה הזו באיומים ישראל תהפוך למדינה שאינה ניתנת למשילות. אנחנו נקבל כאן משהו קרוב מאוד לסומליה."
SagiBarmak,1689692930,2308,104,4,2,"""המהפכה אוכלת את בניה"", הגרסה הישראלית. https://t.co/JCXoibCfbq"
SagiBarmak,1689661795,1396,41,1,1,"מי שומר על ""שומרי הסף""? 

נורברטו בוביו. https://t.co/RyOdkfGjNM"
SagiBarmak,1689656286,6906,234,20,7,אשפוז כפוי. הם טוענים שביטול עילת הסבירות תאפשר לקואליציה לאשפז בכפייה את מתנגדיה. אין תחתית וכו' https://t.co/eG96KG9870
SagiBarmak,1689507618,3026,73,8,6,"מנסחי הפדרליסט היו ערים לכך שלא רק נבחרי הציבור שלנו אינם מלאכים, אלא גם שהשופטים שלנו הם בשר ודם. לא חכמים יותר ולא טובים יותר מאף אחד אחר. הם רצו לאזן ולבלום את כל הרשויות, לא רק את הרשות המבצעת. והם רצו להכפיף את כל הרשויות לשליטה ציבורית, לא רק שתיים מהן. הרשות השופטת אינה חיצונית לשלטון. היא רשות שלטונית. והשאלה בישראל היא מה מונע מבית המשפט העליון (ומהמוצב הקדמי שלו- היועמ""שית) מלעשות שימוש לרעה בכוח שלו."
SagiBarmak,1689493500,4383,152,28,5,מצויין. https://t.co/haF3uYgmxJ
SagiBarmak,1689343847,1833,53,3,3,"""(פורום המרצים למשפטים למען דמוקרטיה) מטעה את האזרחים, מציג תמונת מצב מעוותת של מצב המשפט וגולש ליוריסטוקרטיה קיצונית"". 

פוסט מדאיג ובעיקר עצוב של משה כהן אליה: https://t.co/jstGpYZwdt"
SagiBarmak,1689311526,16102,375,41,48,"מאמר המערכת של ה- WSJ: ""מה יש לביידן נגד ישראל? הנשיא מתנהג לקואליציה הישראלית גרוע מלאיראן"". 

בגוף המאמר: ""כך לא מתייחסים לבעלת ברית דמוקרטית. הישראלים יחליטו בעצמם האם להותיר כוח עודף בידיו של בית המשפט בהעדר חוקה או לנוע קרוב יותר לשיטה הבריטית של עליונות פרלמנטרית"". https://t.co/sESkvK2Ue7"
SagiBarmak,1689260776,59,1,1,0,@DanielKaner2 בית המשפט קבע שחוות הדעת של מנדלבליט מחייבת. היועמשית הנוכחית אמרה שהקביעה הזו עדיין תקפה. https://t.co/4mu12Y8FKo
SagiBarmak,1689252092,633,7,1,2,"🫖 מסיבת התה פרק 7 - עילת הג׳וקר והיועמ״שית

לצפייה ביו-טיוב: https://t.co/s62wS2sryu

להאזנה בספוטיפיי:
https://t.co/r2Hj6Aw3UY

להאזנה באפל: https://t.co/5lBY0itVrI

להאזנה בגוגל: https://t.co/FqX8gNzX5t

או חפשו ״מסיבת התה״ בכל אפליקציות הפודקאסטים"
SagiBarmak,1689231626,56420,532,31,46,"פרייסלס, קרמניצר. פרייסלס. https://t.co/4ujy1tIATT"
SagiBarmak,1689178922,110,1,0,0,@omeraricha https://t.co/PHLxyeJcMT
SagiBarmak,1689171879,510,18,3,0,"@tom_sadeh @RahavBen @shay_galili @ShimonNataf בן אדם, אתה פה? זה ליטרלי מה שאומרים לך לא שגיא ברמק ושמעון נטף אלא היועמשים למיניהם. https://t.co/UYz6qfIKY2"
SagiBarmak,1689167487,951,42,2,1,"@tom_sadeh אני חושב שזכית למספר תשובות לא רעות. אבל ברשותך, בוא נתמקד בציוץ הזה שלך. אם היה לי את הכוח רק *להגביל* את תום שדה, היה לי הרבה או מעט כוח? אם היית חופשי לעשות כל מה שאתה רוצה חוץ ממה שאני אוסר עליך, היית רואה בי רשות שלטונית שיש לפקח עליה בחומרה או לא? https://t.co/bmXgaW0qs9"
SagiBarmak,1689148180,2753,119,10,4,ממשיכים לטמטם את הציבור. https://t.co/n6EYNWOLQi
SagiBarmak,1689140071,3562,149,20,12,"עילת הסבירות אינה עמוד תווך של המשטר הדמוקרטי. 

משטר דיקטטורי הוא אחד שבו נשללות מן האזרחים הזכויות הפוליטיות שלהם. אין אופוזיציה, אין תקשורת חופשית, אין חופש מחאה, אין חופש התארגנות, אין זכויות קניין פרטי, ישנה רדיפה שיטתית של מתנגדי שלטון ועוד.

מטמטמים את הציבור מתא הטייס. https://t.co/1UYm8hGYke"
SagiBarmak,1689093432,3077,128,16,3,טייסוקרטיה. https://t.co/dFjA8UJzLw
SagiBarmak,1689001019,1824,103,1,6,רשת ביג נכנעה מהר למדי ללחץ של הציבור ושל הסוחרים במתחם שהופנה כלפיה. אבל זוכרים מה דה מרקר צייצו רק אתמול? ביחד עם כלכליסט העיתון הזה הפך לפמפלט שטחי של תעמולה פוליטית. https://t.co/EZIyLSLss1
SagiBarmak,1688967081,4965,237,8,29,"5. לסיום, על מומחיות משפטית ודמוקרטיה. את זה ממליץ שתקראו פעמיים: https://t.co/djyGQzXMrV"
SagiBarmak,1688967079,4952,179,1,15,"4. על השינוי שהתחולל במעמד היועץ המשפטי- ""הוא נתפס כמי שעיקר מעייניו אינו לסייע לממשלה 'מבפנים' אלא לפקח עליה 'מבחוץ': https://t.co/V6UlmE2kXB"
SagiBarmak,1688967078,5010,182,2,16,"3. על שלילת ייצוג חלופי לזה של היועץ המשפטי משרים, ראש הממשלה והממשלה עצמה: https://t.co/NG1orfnp85"
SagiBarmak,1688967076,5906,189,2,17,"2. ""בהמולת המאבק בין טובים לרעים נשכחה העובדה שהיועץ המשפטי אף הוא רשות מנהלית"": https://t.co/KrZ6t7Opy3"
SagiBarmak,1688967075,6547,220,2,26,1. על הטענה לפיה חוות דעתו של היועץ המשפטי צריכה להיות מחייבת: https://t.co/WsZecScELF
SagiBarmak,1688927486,915,11,2,0,@amirzait https://t.co/fAnITqlOrh
SagiBarmak,1688887416,16955,257,49,16,זו הרמה. מה אם ראש הממשלה יפטר את כל השרים ויהפוך את עצמו למלך זו החלופה החדשה למה נעשה אם הכנסת תחליט לרצוח את כל הג'ינג'ים. https://t.co/ITm29Bd5co
SagiBarmak,1691311942,10073,219,34,14,"שאלת גבולות הסמכות של בג""ץ היא לא שאלה משפטית ואסור שתהיה מוכרעת בבית המשפט על ידי בית המשפט. במדינה דמוקרטית, בית המשפט לא בורא לעצמו את גבולות סמכותו בהסתמך על אופנה פילוסופית. בית המשפט פועל מתוקף חוק והוא כפוף לדין שקובעת הכנסת- כמו כל גוף או רשות אחרת."
SagiBarmak,1690883641,1388,34,3,0,"השנה אלמד במסגרת המכון שתי תכניות: ""אקסודוס"": למחשבה מדינית עם דגש על תיאוריה דמוקרטית ו- ""סמית"": לכלכלה-פוליטית. תודה לשירה על ההמלצה החמה. מוזמנים להירשם."
SagiBarmak,1690063587,221,7,3,0,@roznaiy מי קבע שאסור לעשות את כל מה שאתה קובע שאסור לעשות? היכן העם הסמיך את בית המשפט למנוע זאת? היכן העם מינה את בית המשפט לפרשן המוסמך של עקרונות היסוד של החוקה/שיטה?
SagiBarmak,1690522006,3102,258,16,12,@NeriaKraus @wolfblitzer למה אסתר חיות לא מבהירה שתציית לחקיקה הראשית של הכנסת?
SagiBarmak,1690522702,4240,85,16,4,"למי המילה האחרונה בשיטת המשטר שלנו? לסיעת הרוב שבהרכב בית המשפט העליון או לסיעות הרוב שבפרלמנט? בלי פסקת התעקשות, בעל הבית בכל השאלות החוקתיות יושב בבית המשפט."
SagiBarmak,1693581630,5156,58,12,1,יש אנשים שנורא קשה להם לשלוט בדברים שיוצאים להם מהפה. ולחשוב לפני. נורא קשה לחשוב לפני שמצייצים. גם אין לזה תרופה. רק הענשה בקלפי.
SagiBarmak,1691900608,1088,24,3,0,@Idaneretz @NirGodin רואה שעוסקים כאן בהגדרה שלי. אני לגמרי מזהה את עצמי ליברטריאן/ליברל-קלאסי מבחינה כלכלית. בדיוק כפי שאני רואה בעצמי שמרן מבחינה תרבותית וריאליסט מבחינה מדינה. זה לא אמור להיות מוזר לכל מי שמכיר שמרנים אמריקאים סטייל רייגן. ויכוחים ציבוריים שונים מדגישים היבטים רלוונטים שונים.
SagiBarmak,1691913654,605,14,1,0,@YonatanFuchs @Idaneretz @NirGodin אני תומך ברפורמה. לא תומך בהרבה מאוד דברים אחרים שהממשלה מקדמת.
SagiBarmak,1693336203,5276,222,11,6,"מבחינתי מה שחשוב בתכנית מחיר למשתכן זה לא אם בוזבזו מיליארדי שקלים שחולקו בהגרלה לאנשים בעלי הון ראשוני תוך כדי החרפת משבר הדיור.
מה שחשוב מבחינתי זה שהיה פה שר אוצר שניסה לעשות משהו כדי שיהיה פה טוב יותר. אבא תרחם."
KoheletForum,1694618422,112015,500,433,54,"סיכום שנה. מה עשינו ברגולציה, כלכלה, חינוך וכיו""ב בשנה החולפת. https://t.co/DkYmbUtVTg"
KoheletForum,1690207534,175649,267,928,22,"פורום קהלת שב וקורא למאמצים להגעה לפשרות ולהסכמות.
על נבחרי הציבור וההנהגה הלאומית להאט ולהקדיש כעת את הזמן הדרוש לדיון ישיר, כן ומעמיק בשינויים הנדרשים במערכת המשפט וביחסי הרשויות.
יש לעשות כל מאמץ להגיע להסכמות טובות ולהשיב את ישראל ליציבות ולשגרה."
KoheletForum,1696425322,7019,180,18,21,"עם שוך הסערה, ניתוח משפטי קצר של פס""ד בעניין תפילת יום הכיפורים בדיזנגוף.

העמדת מחיצה לצורך תפילה אורתודוקסית ברשות הרבים.(עע""מ 7174/23).
#במשפט_אחד: ההחלטה לאסור על מתפללים לקיים באופן חד פעמי תפילה בכיכר עם הפרדה כמקובל בבתי כנסת, משמעותה פגיעה בחופש הביטוי ובחופש הדת בשל &gt; https://t.co/hE3zxEAkoM"
KoheletForum,1695977036,1423,12,7,3,"עו""ד אהרן גרבר, סגן ראש המחלקה המשפטית בפורום קהלת, התראיין ל @avi1mimran ב @newskolhai בעקבות הדיון בנושא הנבצרות, על הייצוג הפרטי של הממשלה, על היפוך התזה שעמדה בבסיס המהפכה החוקתית של ברק ושינוי הסטטוס-קוו.
https://t.co/wgfdOtaHRL"
KoheletForum,1695975828,3108,39,3,0,"רבים התלוננו על השידור של @efitriger בגלי צה""ל בבוקר שלאחר יום הכיפורים. פנינו להנהלת התחנה בגלל התייחסות מניפולטיבית ומכפישה באזכור הפורום ואנחנו מברכים על כך שהנושא טופל משמעתית.
https://t.co/bp9hAOX2XN"
KoheletForum,1695897072,40188,122,37,9,"העובדה שלא אוהבים חוק מסוים לא מהווה עילת פסילה חוקתית. @ptr_dvd במשדר המיוחד ב @kann_news על הדיון בבג""צ בנושא הנבצרות https://t.co/CaQ6pF7Vr9"
KoheletForum,1695882382,2179,24,2,4,"מה צריך לדעת בנוגע לדיון בבג""צ על התיקון לחוק יסוד הממשלה בעניין הנבצרות?

#במשפט_אחד: תיקון החוק נועד להבהיר באילו נסיבות ראש ממשלה יצא ל""נבצרות"", כדי לשלול את הרעיונות של ""נבצרות משפטית"" – שנועדו לעקוף את קביעת חוק היסוד כי ראש ממשלה יודח רק לאחר הרשעה סופית בפלילים.

במארס השנה תיקנה הכנסת את הסעיף בחוק-יסוד הממשלה העוסק ביציאת ראש ממשלה מכהן ל""נבצרות"". מדובר בתוספת לסעיף שכבר היה קיים בחוק-היסוד. הוא נועד למנוע ואקום שלטוני כשראש הממשלה לא יכול למלא את תפקידו ולהעביר סמכויותיו לממלא מקום זמני.

ההסדר המקורי עיצב את הליך היציאה לנבצרות זמנית או קבועה, אך לא הובהר בו מהן הנסיבות שמחייבות יציאה לנבצרות, ומה המנגנון להכרזה עליה. לפני התיקון קבע חוק-היסוד כך: ""נבצר מראש הממשלה זמנית למלא את תפקידו, ימלא את מקומו ממלא מקום ראש הממשלה"". החוק הוסיף וקבע כי לאחר 100 ימי נבצרות ייחשב ראש הממשלה כנבצר תמידית.

התיקון הוסיף לחוק-היסוד הבהרה: ""נבצרות ראש הממשלה למלא את תפקידו… תהיה בשל אי-מסוגלות פיזית או נפשית בלבד"". כלומר, התיקון הבהיר מהו התוכן של אותה ""נבצרות"" – העדר יכולת תפקודית בשל מגבלה פיזית או נפשית ההופכת אותו לחסר מסוגלות. התיקון קבע גם מנגנון ופרוצדורה להכרזה על נבצרות זמנית של ראש הממשלה.

מה פתאום נזכרו לתקן את החוק? הצורך לתקן התעורר כשהחל לצבור תאוצה רעיון בדבר ""נבצרות משפטית"". לפי הרעיון הזה, ייתכן מצב שבו נבצר מראש הממשלה למלא את תפקידו מסיבות משפטיות, ובמקרה שלנו –  מחמת ההליך הפלילי שמתנהל נגדו. הרעיון הזה זכה לאוזן קשבת, במידה מסוימת, בבית המשפט העליון. בעתירות שהוגשו לאחר הבחירות האחרונות נגד הענקת המנדט להקמת הממשלה לנתניהו, בשל ההליך הפלילי נגדו, השופטים לא שללו את האפשרות שתיווצר ""נבצרות משפטית"".

בהמשך, הוגשה עתירה נגד היועצת המשפטית לממשלה כדי שתוציא את ראש הממשלה ל""נבצרות משפטית"", ובית המשפט הורה ליועצת המשפטית להשיב לעתירה ולנמק מדוע לא תעשה כן. בקואליציה ראו בכך רמז לנכונותו של בית המשפט לקדם את רעיון ""הנבצרות המשפטית"" לפסים מעשיים, ולכן פנו מצדם לקדם את תיקון החקיקה המדובר, המבהיר כי נבצרות משמעותה נבצרות פיזית או נפשית בלבד וכי יועץ משפטי לא יכול להוציא ראש ממשלה לנבצרות.

חשוב להבין שרעיון ""הנבצרות המשפטית"" הוא ניסיון ליצור דרך עוקפת להדחת ראש ממשלה. חוק-היסוד קובע במפורש שראש ממשלה לא יועבר מתפקידו גם אם הוא נאשם בפלילים, אלא לאחר הרשעה חלוטה. זה ההסדר שנקבע באופן מודע בשנת 2001. בכלל, מדינות דמוקרטיות קובעות מנגנונים חריגים ומיוחדים להדחת ראשי מדינות הנאשמים בפלילים, כדי שלא לאפשר לתובע פלילי להדיח מנהיג נבחר ולסכל כך את תוצאות הבחירות.

בדיון בבג""ץ נגד התיקון נטען שהוא ""פרסונלי"", כלומר נתפר לטובת ראש ממשלה ספציפי. חשוב לדעת שאין איסור על חקיקה פרסונלית. היא חשודה כבלתי ראויה כי חוקים צריכים לשקף כללים עקרוניים ולא לספק פתרונות למקרים ספציפיים. אולם לעיתים מקרים ספציפיים מציפים צורך בתיקון עקרוני. כפי שהסברנו, ההבהרה של המונח ""נבצרות"" היא הבהרה עקרונית. לכן, לגיטימי שהמניע למהלך החקיקה הוא מקרה ספציפי.

מה המצב כעת? בית המשפט הוציא צו על תנאי בשאלת תחולת החוק. המשמעות היא שבית המשפט דחה את העתירות לפסילת התיקון, אולם העביר למדינה את הנטל לשכנע מדוע תחולתו של החוק לא תידחה לכנסת הבאה. כשנחקק התיקון, חברי הכנסת בחרו במודע שלא להחיל אותו מהכנסת הבאה, בין השאר כי ראו בו הבהרה של המצב הקיים. אם יקבל בג""ץ את העתירה יהיו לכך שתי משמעויות דרמטיות:

א – הענקה משתמעת של סמכות ליועצת המשפטית לממשלה להדיח את ראש הממשלה נתניהו – דבר שאינו קיים באף מדינה דמוקרטית, ולא במקרה.

ב – התערבות של בית המשפט בחוק-יסוד. החלטה כזו משמעותה סופה של שיטת המשפט שנהגה כאן מאז המהפכה החוקתית של אהרן ברק שקבעה שמעמדם של חוקי-היסוד מקביל לחוקה, ומכך נובעת סמכות בית המשפט לפסול חקיקה ""רגילה"". 

כתיבה: עו""ד אהרן גרבר, סגן ראש המחלקה המשפטית בפורום קהלת"
KoheletForum,1695707087,3294,38,1,9,"מה ניתן ללמוד מקנדה על שימוש שיפוטי בעקרונות לא-כתובים? 

החלטה מעניינת של בית המשפט העליון הקנדי מ-2021 רלוונטית מאוד לשיח בישראל: מהו היחס בין ""לשון החוקה"" לבין ""רוח החוקה"" והאם בית המשפט מוסמך לפסול חוקים לפי עקרונות חוקתיים לא-כתובים?

#במשפט_אחד: בפסק דין בבית המשפט העליון בקנדה נקבע כי בית המשפט מזהה את ""המבנה הבסיסי"" של החוקה לפי לשונה הכתוב, ולא לפי עקרונות אמורפיים שאינם כתובים. הסתמכות על עקרונות לא כתובים לביקורת חקיקה חותרת תחת הרעיון של כינון חוקה.

לפי החוקה הקנדית שנחקקה ב-1867, הסמכות לעצב את מוסדות הרשויות המקומיות נתונה לממשלה המחוזית. במהלך קמפיין הבחירות ב-2018 לעיריית טורונטו (העיר הגדולה ביותר בקנדה), ממשלת אונטריו (המחוז שבו טורונטו נמצאת) העבירה חוק שצמצם את מספר נציגי עיריית טורונטו מ-47 ל-25.

עיריית טורונטו עתרה לבית המשפט בטענה שהחוק פגע בהוראות החוקה המבטיחות חופש ביטוי, חופש התאגדות ושוויון. העירייה לא הסתפקה בטענות המתבססות רק על ההוראות המופיעות בחוקה, אלא ביססה את עתירה גם על העקרונות הלא-כתובים בחוקה: דמוקרטיה ושלטון החוק. הדיון התגלגל עד לבית המשפט הקנדי העליון.

לפי בית המשפט העליון, החוקה הקנדית מורכבת מנורמות כתובות ומנורמות לא-כתובות. אלה האחרונות מסייעות לבתי המשפט בשני אופנים שונים. הראשון, עקרונות לא-כתובים יכולים לשמש כלי פרשני, השופך אור על תכלית החקיקה או על תוכן הזכויות המנויות בה. השני, עקרונות אלו יכולים גם להשלים לאקונה (חוסר) בחוקה.

אבל הוא גם קבע במפורש שעקרונות לא-כתובים אינם יכולים להוות בסיס עצמאי לפסילת חוקים. זאת מכיוון שהם לא נוסחו באופן ברור ולא עברו וועדות פרלמנטריות, ורמת המופשטות שלהם גבוהה. כך למשל, אין תוכן מוגדר לביטוי ""דמוקרטיה"". בית המשפט הקנדי העליון קבע כי מסירת הפרשנות של העקרונות המופשטים לידי בית-המשפט חותרת תחת רצון העם, המתבטא בהכרעה בקלפי ובהליכי החקיקה. כמו כן, החוקה הקנדית מאפשרת לפרלמנט להתגבר על פסילת חקיקה הסותרת זכויות ספציפיות המנויות החוקה, אך על סמך עקרון לא-כתוב אין אפשרות לפרלמנט להתגבר על פסיקה של בתי המשפט.

בית המשפט הקנדי העליון אף הוסיף וקבע ש""ניסיונות אלו [פסילת חקיקה על ידי עקרונות לא כתובים בחוקה] חותרים תחת סמכות המחוקק לתקן את החוקה, ובכך מעלים חששות כבדים על אודות הלגיטימיות של הביקורת השיפוטית ועיוות הפרדת הרשויות"" (תרגום על ידי הכותב).

לבסוף, בניגוד ללשון החוקה הכתובה, המעודדת ודאות משפטית וצפיות בהפעלת הביקורת השיפוטית, טבעם החמקמק של עקרונות לא-כתובים עלול להתפרש באופן ""המייתר רבות מהזכויות החוקתיות הכתובות"", ולחתור ""תחת תיחום הזכויות על ידי מכונני החוקה"".

בשל הנימוקים שצוינו, קבע בית המשפט הקנדי העליון שלא ניתן לפסול חקיקה על סמך עקרונות לא-כתובים.

השימוש בעקרונות יסוד חוקתיים לא כתובים נדון בהרחבה בימים אלו בישראל, בהקשר לפסילת חוקי יסוד וחקיקה. טוב יעשה בית המשפט העליון בישראל אם ישקול את הנימוקים שצויינו על ידי בית המשפט העליון הקנדי, ויפעיל זהירות בשימוש בעקרונות אלו.

כתב עו""ד אברהם של""ו, חוקר במחלקה המשפטית בפורום קהלת."
KoheletForum,1695390373,1503,11,2,0,"השבוע פתחה אזרבייג'ן במבצע צבאי בנגורנו-קרבאך, מובלעת ארמנית שעליה היא טוענת לבעלות והביאה לכניעתם של הארמנים. פרופ' @EVKontorovich, ראש מחלקת משפט בינלאומי בפורום קהלת, ציין ב - @WSJopinion ארבעה לקחים שניתן להפיק מהאירוע מהזווית של המשפט הבינלאומי."
