author_username,created_at,impression_count,like_count,reply_count,retweet_count,text
Meir_Rubin,1689085776,29841,208,32,0,🤦🤦🤦 https://t.co/sqUSOZePai
Meir_Rubin,1689186536,25669,19,5,0,"@Yehuda_Gizbar @matanoss כן, בעצם. ראיתי פרק אחד מסיינפלד, אחד מחברים, כמה משפחת סימפסון ועוד פה ושם."
Meir_Rubin,1695362052,125412,1481,171,151,"רוטמן: ""האם בהפגנה מול פורום קהלת הותקף המנכ""ל פיזית?""

שרף: ""לא"".

ובכן, הותקפתי פיזית."
Meir_Rubin,1696672045,1096,10,0,0,מלא פה אבל מבקשים שיגיעו עוד. https://t.co/vgACuEcnaw
Meir_Rubin,1696667833,7138,71,4,6,בואו. https://t.co/pTMSnZdLiX
Meir_Rubin,1689221536,14175,140,12,5,לא נגעתי. https://t.co/zfopd5IaBX
Meir_Rubin,1689175491,40352,90,42,0,"עונה 1 פרק 2, עלילה מופרכת לחלוטין על דתי לאומי שמאמין שיש קדושה בחתיכת בשר בגלל שאפשר לראות בה פרצוף מעוך. מצד שני, נרשם חיוך על הביטוי ""צדיק בלי תיק"" אז יצאנו עם משהו. https://t.co/6yBHpZPZfY"
Meir_Rubin,1689152369,2763,20,6,0,@amsterdamski2 בסנדלים 9 חודשים בשנה. https://t.co/WhH7j6tw9M
Meir_Rubin,1689098550,479,8,0,0,"@BarkolAmir נולד בגינה שלנו לחתולת רחוב, מחפש בית חם. https://t.co/cZrNCdOkWw"
Meir_Rubin,1689087462,50727,156,49,0,"עונה 1 פרק 1, מעל מאה שחקנים ואנשי צוות הפקה הפיקו לכאן ***חינוכית*** פרק שבו מנהלת סופר מפתיעה עובד ערום במשרד שלה וקופאית נושכת לקוח קשיש עד זוב דם. 0 חיוכים מצידי. https://t.co/jRqKLhkxGN"
Meir_Rubin,1689078429,4621,24,3,0,פרקים 4-8... אאוץ'. https://t.co/0A4uEeVV39
Meir_Rubin,1689068517,1137,24,2,1,"ברור שניסו לתת לאמבולנס לעבור, בפועל מעכבים אותו מאוד לעומת מצב רגיל. ""נרשמים עיכובים משמעותיים בתנועת אמבולנסים"" זאת מציאות עובדתית פשוטה.

הנה: https://t.co/efHAQbFkqR"
Meir_Rubin,1689067945,10222,185,38,7,בושה. https://t.co/urpBVDJSFe
Meir_Rubin,1689052370,970,7,3,0,@GutmanYotam @OmerPerchik וזאת אשתי בחדר הפיקוד של ספינת המלחמה הראשית. מוזמן למצוא לי תמונה שלך מחדר הפיקוד של ספינת מלחמה זרה. https://t.co/uKoiQCQctU
Meir_Rubin,1689052281,2885,14,5,0,"@GutmanYotam @OmerPerchik קח, ליצן. אני  Ship Agent בפארל הארבור על ספינת עבודה מלוכלכת. https://t.co/nTqQTmYJ2C"
Meir_Rubin,1689051172,1793,40,3,0,@GutmanYotam @OmerPerchik יש עוד המון. https://t.co/RBRv49old7
Meir_Rubin,1689051105,10332,93,9,0,"@GutmanYotam @OmerPerchik מקייאקים ועד ספינות מלחמה וספינות מפרש חינוכיות שמקיפות את העולם בכל שנה, יצא לי לחוות לא מעט. תודה ששאלת. https://t.co/2v4vEZIl1I"
Meir_Rubin,1689002901,140,0,1,0,"@GadiAleks נשיא בית הדין הארצי לעבודה דאז סטיב אדלר גם לא משכנע אותך? ""אינם בגדר שביתה חוקית"" משפט בעברית שמשמעו שהצעדים שננקטו הם שביתה לא חוקית. https://t.co/ExG6kOfUdQ"
Meir_Rubin,1688961811,84833,761,47,3,"אצפה בפרק של קופה ראשית על כל 100 לייקים פה... אל תגזימו אבל.
https://t.co/9GT21doiXN"
Meir_Rubin,1688928212,259,1,1,0,@gontarzn זה מתוך פסק דין 'בזק' של העליון. https://t.co/bLURz4Owob
Meir_Rubin,1688925333,1638,44,3,2,קלאסי. https://t.co/BiLYf4d9W0
Meir_Rubin,1688918727,11669,198,23,29,"עובדים, בשבילכם. https://t.co/F9FzCpj0iG"
Meir_Rubin,1689181115,4633,20,4,0,"@Yehuda_Gizbar אני לא ""חווה סדרות"", זאת פעם ראשונה בחיי שאני רואה סדרה ככה."
Meir_Rubin,1689187135,4116,28,2,0,"@matanoss @Yehuda_Gizbar אני יליד 1983. בבית לא הייתה טלוויזיה ובאופן כללי העדפתי ספרים או ספורט. כן ראיתי לא מעט פרקים של דנבר הדינוזאור האחרון אצל שכנים בימי שלישי אחר הצהריים, אבל זה היה לפני 30 שנה בערך."
MisgavINS,1695991963,501646,162,130,25,"שלוש שנים להסכמי אברהם - עתיד השלום האזורי
כנס מיוחד של מכון משגב לביטחון לאומי ולאסטרטגיה ציונית בהשתתפות נציגים רשמיים, שרים ובכירים ממדינות האיזור

להרשמה: https://t.co/wA1ZE646KR https://t.co/ytUex2gIC9"
MisgavINS,1692772449,737,2,0,1,"ראש מכון משגב לביטחון לאומי ואסטרטגיה ציונית, מאיר בן שבת: נכון להמשיך במדיניות הבידול בין עזה לאיו""ש ולבחון מחדש את המדיניות בנוגע להיתרי העבודה לפלסטינים מהרצועה. נכון להגביר את מאמצי הסיכול במיוחד כנגד תשתיות חמאס בכל שטחי יו""ש.

לקריאת הכתבה המלאה:
https://t.co/6rCaONIQfH https://t.co/zKOXGjY8A7"
ptr_dvd,1694019874,9599,408,31,34,"דברים חשובים מפי ראש הרשות המחוקקת.
מציע לכם לצפות בדברים המלאים ולא להסתפק בכותרות ובמיסגור שבוחרים עבורכם אחרים."
ptr_dvd,1689762316,10698,112,53,4,"מה גורם לאנשים רציונליים לא להכין מלפפונים כבושים?
פי אלף יותר טעים מכל מה שתקנו, כלום כסף, מוכן תוך ימים ספורים בחום הזה.
וזיכרונות ילדות מכים בכם כאילו יש קוקטייל אייוואסקה, סן-פדרו, דיאמטי ופסילוסיבין בכל ביס.
מוש. https://t.co/OTPZmliPfP"
ptr_dvd,1692897560,7728,71,20,2,"מוסרית מדובר במעשה מתועב ושפל.
אך יש קשיים תאורטיים לא מבוטלים ביישום הפללה של שקרים שקודמים ליחסי מין.
קו הגבול בין מעשה פלילי ללא פלילי כלל לא ניתן לשירטוט ויש אינדיקציות ליישום בפועל בעיקר במקרים של גברים בני מיעוטים ואוכלוסיות שוליים שמתחזים לשכבות הגבוהות.
ראוי לדיון ציבורי."
ptr_dvd,1696577301,102849,813,68,64,"החולשה שמקרינה מדינת ישראל בתחומי הביטחון וביטחון הפנים מזכירה לי ילד שמשחק שחמט.
הוא מספר לעצמו שאובדן הרץ, הצריח והפרש זו הקרבה (""גמביט"") כי יש לו מהלך על מה שחשוב באמת.
רק שמהר מאוד מסתבר שלא עסקינן בבובי פישר ולא במיכאיל טל אלא בילד רגיל שנשאר בלי כלים.
יקיץ הרי הקץ על האשליה שסעודיה, המב""מ ואיראן, חשובים ככל שיהיו - הם הצדקה להפקרות שמתחוללת כאן.
וקצה של אשליה זה תמיד אירוע מכוער."
ptr_dvd,1693244025,3960,143,11,10,"זה המקום להזכיר שיש לפורוש רקורד עשיר מאוד של ביקורים אצל ברלנד לאחר שנעצר ואף לאחר שהורשע וקידום אינטרסים שלו כמו מאבק על מקומו בל""ג בעומר במירון.
חרפה מוסרית איומה. קלון גדול.
אין בי אלא בוז לחברי הקואליציה שלא אומרים מילה על התופעות הללו. https://t.co/wTKIAYKw4k"
ptr_dvd,1689530609,2166,24,10,1,אין הרבה שמחות כמו השמחה כשג'וקוביץ' מפסיד
ptr_dvd,1689774516,11901,251,70,9,מה היה לפני שהתפתחה עילת הסבירות הרחבה?
ptr_dvd,1690708547,14736,411,55,25,"לא הבנתי. חשבתי שסבירות תביא דיקטטורה.
אני מבולבל כבר."
ptr_dvd,1690535926,4069,59,8,2,פרופ' אדם שנער צודק
ptr_dvd,1695879137,91013,1476,64,51,"זה לא סתם סטנד-אפ, זו אומנות.
גאון. https://t.co/MLmFcgbG1F"
ptr_dvd,1694619620,18911,351,58,24,"אין יום שאני לא אומר תודה על כך שנפל בחלקי לעבוד לצד אנשים כל כך נפלאים.
שנה טובה."
ptr_dvd,1688920396,47438,645,158,67,"מתי תתעוררו?
כשיישפך דם? https://t.co/sK4xayI7nB"
ptr_dvd,1690187965,17251,349,38,43,"צפו!
---
ובהרחבה: מתקשים להתמודד עם העובדה שפספסתם אותי אתמול בערב בפאנל של 'חדשות הלילה' ב @kann_news?
לציוץ זה מצורף מזור למכאובכם.
קחו כוס קפה וצפו: https://t.co/8D5pSI3hZX"
ptr_dvd,1694538331,75537,1402,471,168,"אני אזרח ישראל.
אני לא רוצה שופט שזו תפיסתו בתור נשיא בית המשפט העליון במדינתי.
מה בכוחי לעשות כדי להשפיע בעניין? https://t.co/GnxnsimUi8"
ptr_dvd,1694442875,20229,245,29,53,"להלן קטע מתוך דברי ההסבר להצעת חוק יסוד בתי המשפט.
הצעת החוק הזו לבסוף נחקקה בפברואר 1984 כחוק יסוד השפיטה.
סעיף 15(ג) העניק לביהמ""ש סמכות להעניק סעדים על פי דין אם אין בחקיקה סמכות עניינית לערכאה אחרת, או אף במקביל לערכאה אחרת אם יש הצדקה לכך. זה הכל.
הכנסת אמרה במפורש שאם תרצה להעניק לבית המשפט סמכויות חוקתיות היא תעשה זאת בבירור בחוק יסוד עתידי.
לא בכדי פסק דין בנק המזרחי לא נתלה בסעיף הזה. כי זה פשוט שגוי.
כיום בתקשורת, לדוג' @sefiova, אומרים שס' 15(ג) מקנה אפילו סמכות על-חוקתית אל מעבר לחוק יסוד השפיטה ואל מעבר לחוקי היסוד עצמם.
זו פשוט טעות.
זה מביך שיש אפילו עותרים שטוענים את זה בפני בית המשפט בבג""ץ הסבירות.
אפשר להסכים שנקיים את הדיון בתוך גבולות ההגיון, המשפט והאמת?"
ptr_dvd,1693396792,32245,961,60,135,"אין שום משמעות למאמר של אהרן ברק שמנסה לבסס מקורות ראשוניים חדשים לשיטת המשפט בישראל.
בדמוקרטיה יש 3 מקורות לנורמות משפטיות:
א. הפרלמנט - בחקיקה.
ב. הממשלה - בתקנות.
ג. בית המשפט - בפסיקה.
אנחנו לא בישיבת מקובלים ונשיא ביהמ""ש העליון בדימוס אהרן ברק לא כותב סודות על קלף."
ptr_dvd,1689577174,11978,267,21,62,אופסי בופס https://t.co/FN4FvLz58E
ptr_dvd,1696341730,23664,553,51,12,"טוב מסתבר שביני אשכנזי חסם אותי על התגובה הזו.
🤷‍♂️"
ptr_dvd,1693981913,16559,376,22,48,"תמיד כדאי להזכיר שהש' קרא בדעת מיעוט סבר שצריך לבטל את חוק הלאום כי הזכות להגדרה עצמית לאומית של היהודים בישראל, השפה העברית וההתיישבות היהודית  ""שוללים את ליבת הזהות הדמוקרטית של המדינה ומזעזעים את אמות הסיפים של המבנה החוקתי"".
כלומר הקונצנזוס הכי רחב של המפעל הציוני הצדיק בעיני הש' קרא לשבור את כל שיטת המשטר הדמוקרטית ולבטל חוק יסוד.
ומה לדעתכם יקרה אם אבי מעוז, לדוג', יהיה שופט והוא יכריע מה פוגע ביהדותה של המדינה?
אתם מבינים שהכרעתו תיגבר על כל חקיקה?
חברים, הלכנו לאיבוד.
בבקשה מכם, בואו נשוב לכנסת.
זה מאלץ את כל קצוות החברה להתיישב ולמצוא מכנה משותף. ואם אחרי זמן מה לא מרוצים, אז משנים.
אבל כולם חלק מהמעגל.
הכנסת היא ארוחה גדולה שבה יושבים השכנים הערבים, העולים החדשים מצרפת, הדודה שהתגרשה ועכשיו היא לסבית שמפעילה בית תמחוי, האחיין שהתחרד והוא יושב עם הסבא ללמוד, הגרוש החמוד שעדיין מגיע והוא מח""ט בבקעה והגיס שפתח סדנאות להעמקת הקשר אדם-כלב בעין גדי.
כן וגם יש את הבלתי נסבלים וזה מצוין, זה חלק מהאווירה.
זה נהדר.
הש' פוגלמן לבד, הש' קרא לבד או הש' העתידי אבי מעוז לבדם זה אסון.
תנו לחירות הפוליטית לפרוח.
כבשן הפשרות הזה מייצר את התוצאה שרוב האנשים רוב הזמן חיים איתה בשלום.
הרוב משתנה, הזמן משתנה וגם ההחלטה משתנה.
יחי הפרלמנטריזם.
תחי הכנסת."
ptr_dvd,1695979884,27155,607,89,69,"שימו לב להחלטת השופט אלטוביה בעתירת ראש יהודי נגד עיריית תל אביב שהחליטה לשלול את ההיתרים שלהם לאירועי סוכות ושמחת תורה.
החוק החדש הגביל את סמכות ביהמ""ש מלדון בסבירות החלטות של שרים ומליאת הממשלה בלבד.
איך זה קשור בכלל לעתירה נגד החלטה של עיריית ת""א?
זה לא קשור.
תמוה ביותר. https://t.co/kC9y28teNU"
ptr_dvd,1695979884,27153,607,89,70,"שימו לב להחלטת השופט אלטוביה בעתירת ראש יהודי נגד עיריית תל אביב שהחליטה לשלול את ההיתרים שלהם לאירועי סוכות ושמחת תורה.
החוק החדש הגביל את סמכות ביהמ""ש מלדון בסבירות החלטות של שרים ומליאת הממשלה בלבד.
איך זה קשור בכלל לעתירה נגד החלטה של עיריית ת""א?
זה לא קשור.
תמוה ביותר. https://t.co/kC9y28teNU"
ptr_dvd,1691870581,32619,404,52,40,"חברים, במקום לקרוא עוד ועוד כתבות שמוסגרו לכם על ידי יועצי התקשורת של המחאה בואו, ברשותכם, ננסה לעלות רמה.
להלן התרחישים המציאותיים מהם צריך להיזהר:
א. ביהמ""ש לא יפסול את התיקון לחוק יסוד השפיטה שנוגע לסבירות.
ב. ממילא אין לממשלה מה ""לציית"" כי התיקון נוגע לסמכויות ביהמ""ש. כל השיח הלא רציני הזה הונדס ע""י יועצי תקשורת מסיבות מובנות.
ג. מהפכה חוקתית שנייה, שידור חוזר של פס""ד בנק המזרחי. הכרזה על סמכות ביהמ""ש לפסול כל הסדר עתידי בנוגע לבחירת שופטים. וזאת מבלי לפסול את החוק שנידון.
ד. התוצאה: לא יהיה ניתן לתקן את כללי המשחק השבורים שלנו בלי הסכמת ביהמ""ש העליון. יווצר מה שאני מכנה ""שיטת הצוללת"". צריך 2 מפתחות כדי לפעול. כל צעד ידרוש הסכמה פוליטית והסכמה של ביהמ""ש העליון. במובן החוקתי הגבוה יהיה זה מעין ""ממשלה פריטטית"" של הפרלמנט וביהמ""ש. או אם תרצו ""בית עליון"" לא נבחר.
במובנים דמוקרטיים תהיה זו פרווסיה שקשה לנסח את הדרך ממנה חזרה.
וכל זה יתרחש תחת מטריית ידיעות תקשורתיות על כך שביהמ""ש ""הכשיר את חוק יסוד הסבירות"" וכמה בג""ץ אחראי ומרוסן שהוא לא פסל את החוק.
ה. GAME OVER."
ptr_dvd,1690203441,5815,489,17,34,"בפעם הראשונה שילד ניצב זקוף ואומר ""לא!"" ניכר שהוא התפתח בצורה בריאה.
כך הכנסת, גם אם יש לה עוד הרבה מאוד לאן לצמוח, מראה סימני בריאות מעודדים.
צעד קטן למחוקק.
צעד גדול לדמוקרטיה הישראלית."
ptr_dvd,1695838012,3776,64,10,0,"נדמה לי שכבוד השר על אוטומט מהניינטיז.
איזה נשק ""חילקו ונתנו כאן"" לארגוני הפשיעה במגזר הערבי?"
ptr_dvd,1696602275,17101,126,9,5,"@aviadglickman @Nehemia_GA @rothmar ראה דבריו של הנשיא המנוח לנדוי (אותם הביא גם סולברג במאמרו המפורסם).
מצרף גם קטע מספרה של פרופ' מרגית כהן על דבריו של הש' ברנזון.
מניח שלא קראת לא את זה ולא את זה. אז סוף השבוע זו הזדמנות ללמוד ולהשכיל.
אגב הלעג הקבוע שאתה מבטא כלפי הזולת לא מחמיא לך אביעד. https://t.co/SsNmRaFTYJ"
ptr_dvd,1696501323,7684,246,31,26,"תעברו היטב על מי שחתום על המודעה הזו.
הם רוצים משפט וצדק או שהם רוצים תוצאה מסוימת?
הכל גלוי, רק צריך להתבונן. https://t.co/ngwiJ33AkA"
ptr_dvd,1696493739,12638,551,43,48,"חייבים להבין - 
בדמוקרטיה פרלמנטרית לפעמים תהיה פגיעה בזכויות לאחר דיון והסכמה חברתית על כך שהפגיעה מוצדקת. ואת ההחלטה ניתן לשנות בקלות רבה אם לא אוהבים את התוצאה.
אך במדינה בה עולם המשפט הוא מבצר של אופוזיציה פוליטית פשוט אין זכויות. נקודה. https://t.co/oYTYFEg3tx"
ptr_dvd,1696416587,2613,35,5,0,"אפרופו נצרות איך אפשר לא להיזכר ביצירת המופת ""צניעות"" של אנטוניו קורדיני (1688-1752).
כישוף בשיש. https://t.co/yRu8hdiiFD"
ptr_dvd,1696349117,7532,81,22,2,אין הרבה פשעים בקנה מידה של הפשע שזו הכריכה של התרגום העברי למרקוס אורליוס https://t.co/ysM5gUiaBj
ptr_dvd,1696340570,2394,302,3,5,@LOdinaev @BiniAshcknasy זו? https://t.co/LHK1RotVbZ
ptr_dvd,1696152086,10254,155,11,15,"אני מצייץ מתוך מצודה שנבנתה תחת שלטונו של יוסטיניאנוס הקיסר הביזנטי במאה השישית.
מעניין לציין שיוסטיניאנוס הורה על רפורמה משפטית מקיפה.
במקום אינספור חוקים רומיים משובשים, פסיקות סותרות , טעויות ומנהגים כאוטיים -  יוסטיניאנוס הורה על חיבור קודקס חקיקה פומבי, עקבי ואחיד.
חוק צריך להיות מכוח הריבונות המקובלת באותה עת, אחיד, כללי, פומבי ועקבי.
כעת נסו להרהר כמה מהסוגיות שמסעירות את החברה הישראלית (ביקורת שיפוטית על חוקי יסוד, נבצרות, סבירות, סמכויות יועמש, הפרדה מגדרית ועוד) מוסדרות על ידי נורמות שעונות לקריטריונים הללו.
הקודקס שיצר יוסטיניאנוס (ה'קורפוס יוריס קיביליס') שלט נורמטיבית במרחב קרוב למילניום.
מעבר לפגיעה בחירות האזרחית שלנו האקטיביזם השיפוטי והייעוצי יוצרים מרחב חברתי-נורמטיבי לא יציב.
זו בעיה קשה.
וכעת אתפנה לחלק דוריטוס לילדים במבצר.
מועדים לשמחה."
ptr_dvd,1695972636,4661,145,7,17,זה ממש נכון 👇👇👇 https://t.co/YLfXFywsFZ
ptr_dvd,1695912845,5214,170,12,16,"צפו!
לקט מהערותיי על בג""ץ הנבצרות הבוקר ב@kann_news.
בנוסף - צפו! https://t.co/1mV4yIWDuY"
ptr_dvd,1695830701,3415,94,1,0,@Bar_ShemUr הם ידעו מראש אחי אומר לך אחי בדוק אחי https://t.co/q3qkRcPRN3
ptr_dvd,1695799401,74,1,0,0,"@shtoren @YBenshemesh אחד מפסקי הדין החשובים בסוגיית השפיטות. היום היא נתפסת כ""מיושנת"".
ראה התייחסות לכך מתוך תגובת רהמ לעתירות: https://t.co/Xq7XwmUetd"
ptr_dvd,1695536708,5608,105,8,5,"כותרת המאמר: ""פרשנות מעצימה דמוקרטיה"".
למה הכוונה כאן במילה 'דמוקרטיה'?
למה הכוונה כאן במילה 'פרשנות'?
ומה בעצם מועצם כאן?
נקודות למחשבה. https://t.co/HE3nOvT7x6"
ptr_dvd,1695315132,3194,30,3,0,"א. למדתי משהו חדש! לא ידעתי מה זה בוכנה הולנדית. הנה תמיד ידעתי שזה לא בזבוז זמן להיות פה. ידע זה כוח!
ב. מדהים איך שיח ענייני מוציא את הרדיקלים מדעתם.
ג. חיים בסרט. @ShimonNataf לא הטעם שלי. היה מת. https://t.co/uh5fkCg5Mi"
ptr_dvd,1695228838,10149,227,19,16,"אני משפשף את העיניים בתדהמה.
משנה לפרקליט המדינה לשעבר(!) לא מבין מדוע יש בעיה ביצירת תמריץ להפרות חוק מצד אנשי אכיפת החוק.
השיקול היחיד בעיניו הוא ""חקר האמת"".
לא פחות ממפחיד.
מזכיר לי את הדברים הנוקבים שכתב הש' אלרון אל מול הש' עמית בפס""ד אוריך ובבן-אוליאל.
מצ""ב - המלצת קריאה. https://t.co/vT3d7zQV9d"
ptr_dvd,1695190937,545,11,2,0,@considerthefish 🤡 https://t.co/rZrtISHINd
ptr_dvd,1695154549,23164,752,110,67,"מפגינים בתל-אביב רודפים אחרי מנכ""ל ""ראש יהודי"" ישראל זעירא. https://t.co/vK8CSKG5VX"
ptr_dvd,1695146888,2323,85,6,3,"@NWeinryb @orcarmi מומלץ לקרוא בעצמך במקום לקרוא לעזרה מחנאית מצד יוזר אנונימי שכבר שיקר בעבר שוב ושוב ביחס לפסק הדין הזה ממש.
https://t.co/Drftd9l29H
https://t.co/CZjwOxGcIB https://t.co/ISfOutCiig"
ptr_dvd,1695021929,15492,467,20,60,"אפשר ללמוד הכל מהתבוננות בסמלים.
""פורום המרצים למשפטים למען הדמוקרטיה"" פרסם ברכת שנה טובה.
שימו לב שהמוטו הצרפתי המפורסם ""חירות, שוויון ואחווה"" עבר שינוי קל.
החירות הוסרה.
וללוגו המאזניים התווסף אגרוף.
הכל מתחיל בשאלה האם מאמינים בחירות של כל אחד מאזרחי ישראל.
כל היתר נגזרות. https://t.co/6kKETaN1hl"
ptr_dvd,1694778750,9308,379,18,53,"אתמול בכאן11 דיברתי כמה מילים על הפגם שנפל בסדרי הדין בעתירת כינוס הוועדה לבחירת שופטים.
טוב עשה בית המשפט שאכן תיקן זאת היום.
עם זאת צריך לומר שגם אין שום צדקה משפטית עניינית למתן צו על תנאי עוד טרם התקיים דיון בעתירה זו.
התרגלנו לכך שהדין משתנה בהתאם למצב ולפרסונות.
מדאיג מאוד. https://t.co/et2upHv0mk"
ptr_dvd,1694764027,20138,274,13,7,נא להתפלל ביום הדין על הילד הזה https://t.co/n2hNPnBJi8
ptr_dvd,1694726286,9094,320,30,38,"אם תצפו ב-4 דק' שנחתכו מתוך התוכנית הנהדרת של @kerenu9 ב@kann_news תקבלו:
א. עימות עם מר יאיא פינק.
ב. התייחסות לכמה מהאירועים על סדר היום.
ג. הפתעה מיוחדת! אשת השנה שלי.
צפו! https://t.co/FrlnW23P12"
ptr_dvd,1694711069,19543,247,12,36,"שמחתי מאוד לשוחח עם @GadiTaub1 על הדיון בבג""ץ, מגילת העצמאות, ליברליזם והמצב החוקתי בישראל.
יש הרבה ערך בשיחה נינוחה ופיתוח רעיון עד הסוף. לא תמיד יש לדברים הללו פלטפורמה.
צפו!
https://t.co/0Gy5TLEpna"
ptr_dvd,1694690918,27963,661,22,130,מה מה מה? https://t.co/LSZfyLbbjn
ptr_dvd,1694624925,5003,297,25,23,כדאי להבחין שכשהם אומרים עצמאות הם מתכוונים השתחררות מהחוק https://t.co/jn05rpvzvD
ptr_dvd,1694550718,14200,269,28,42,"צפו!
כמה נק' מעניינות שעלו היום ב@N12News אצל @Ofer_Hadad: https://t.co/8g8xhStoWI"
ptr_dvd,1694526477,12539,473,50,63,צפו. זה נחמד. https://t.co/UDPdBf6nrk
ptr_dvd,1694511481,3212,218,9,5,ראו הוזהרתם https://t.co/SBcHaYHFtJ
ptr_dvd,1694464322,8787,124,3,9,ממליץ בחום לקרוא את הדברים של @AlexRif3: https://t.co/e94YkVKQRW
ptr_dvd,1694453874,1316,13,2,1,"""כל הברברת על קיומו של אלוהים, אתאיזם, דטרמיניזם, חירות, החברה האנושית, מוות וכו', אלו רק כלים על לוח השחמט שנקרא שפה.
והם מהנים רק אם אדם לא מעסיק עצמו בניצחון או הפסד"".
[מרסל  דושאן  1887-1968] https://t.co/dCfmhfvVhj"
ptr_dvd,1694451990,1962,86,5,7,"""...אין ""מקצוע"" שמכשיר לפתור בנוסחאות מהו שוויון, מיהו יהודי, או מהי מדיניות ההגירה ה""נכונה""... השיח המשפטי בהיבטים הללו אינו אלא פרגוד שחוצץ בין האזרחים לזירת קבלת החלטות"".
---
קחו כוס עם קרח מים ולימון וקראו את הטור שלי ב@MakorRishon. https://t.co/oUTXaugwGC"
