author_username,created_at,impression_count,like_count,reply_count,retweet_count,text
SaraHaetzniCohe,1690815118,2243,57,2,1,"יצאנו ליום סיור בגליל, בשטחי המרעה של קיבוץ מורן להם זכינו לעזור קצת השנה במאבקים שונים. ברקע: הארבל היפה. https://t.co/fRk8aEr6SV"
SaraHaetzniCohe,1690746753,5038,195,9,5,"הוא השווה את עצמו עכשיו לטיטוס, הרמטכל הכושל הזה? https://t.co/ysD8llpaXf"
SaraHaetzniCohe,1690741249,36,2,0,0,@YMacales @gadmeyer לא כבד ומדכא מדי אני מקווה https://t.co/JpMgtwO0lN
SaraHaetzniCohe,1690478402,3205,95,9,0,"האם עשיתי היום בשיא הצום סדנת אפייה לילדים שלי ולחברות של הבת המתוקה שלי? 
הו כן. https://t.co/PTTHUcCzsF"
SaraHaetzniCohe,1690455843,2117,46,1,0,"מעגלי שיח בבית הנשיא בט' באב. לא יצאה תורה אבל יצא שיח, וגם זה משהו בעל ערך בימים סוערים. https://t.co/etV5VmldGg"
SaraHaetzniCohe,1690184622,3715,120,18,10,"בטח חשבתם שזה ייגמר בצד אחד נכון?
לא יודעת אם וכמה הידיעה הזו נכונה, אבל זה משקף סנטימנט רציני בימין. 
הטייסים הסרבנים מקריסים על כולנו את הבית. https://t.co/HC6IK8YYnh"
SaraHaetzniCohe,1690134495,7238,152,14,2,מהמוצדקים https://t.co/BJaHB7psmh
SaraHaetzniCohe,1690129561,68027,1187,138,37,באנו בהרכב משפחתי מלא כדי להגיד כן לדמוקרטיה לא להפיכה צבאית. https://t.co/VCfkKCYyr1
SaraHaetzniCohe,1689879492,6305,335,13,19,"מה לכל הרוחות חשבתם שיקרה כשאלוף (!) במיל'נמרוד שפר הודיע קבל עם ורדיו שהוא לא היה מגיע להפציץ את האויב בסוריה? ומתוך חיל האוויר בהווה או בדימוס, קול דממה דקה. אין שום קול שיוצא באופן חוצץ נגד אמירות מסמרות שיער שכאלה. אז מה חשבתם שיקרה? https://t.co/qxLcgj3Ngm"
SaraHaetzniCohe,1689879487,4069,223,3,9,"מה חשבתם שיקרה כשתתי אלופים החליטו שהם לא מתייצבים לפעילות בצבא והתגאו בזה, תוך שהם מקבלים מחיאות כפיים מכל מיני בן כספיתים ותקשורת נוספת? מה חשבתם שיקרה כשהכותרות זעקו שטייסת 69 כמעט כולה לא מגיעה לאימון מילואים? https://t.co/XTdYcCuezB"
SaraHaetzniCohe,1689879485,3751,234,4,8,"מה חשבתם שיקרה כשמאות ""אנשי חיל האוויר"" הוציאו תמיכה חד משמעית ב""השעיית"" התנדבות, בלי שום קול מנגד? כשמיטב טייסינו התראיינו בפריים טיים N12 והודיעו ש""לא תהיה תקיפה באיראן"" ולא היתה שום תגובה ממפקדי הצבא? שום קריאה נגד ההפקרות הזאת? שום בדיקה, הדחה, נזיפה, משהו. https://t.co/cnPNKWgmmo"
SaraHaetzniCohe,1689879482,42956,897,167,82,"זה שברון לב, אבל היה באוויר כבר חודשים: משבר חוסר האמון בין חיל האוויר לחברה הישראלית.
תגידו, מה חשבתם שיקרה? כשהקמתם פורומים מיוחדים שמאיימים בסרבנות (סליחה, ""חוסר התייצבות"")? כשהפלתם את המדינה על הברכיים בסבב הראשון כי הבינו שהכשירות המבצעית בסכנה. 
&gt;&gt; https://t.co/TXYUOTG7oJ"
SaraHaetzniCohe,1689250296,3514,166,7,10,"איפה עמוס ידלין וחבורתו?
ווין ווין. חה. https://t.co/uawTgBIFYx"
SaraHaetzniCohe,1689243146,2717,121,7,9,"""מה שווה התאגיד אם אנחנו לא שולטים בו"" https://t.co/1wgsF2Ncpc"
SaraHaetzniCohe,1689104474,21806,598,85,64,"חבר, תושב קיבוץ חנתון, שכן של השר עמיחי שיקלי. קצין בכיר, אקדמאי מחונן. 
העיקר בוכים פה על שמחה רוטמן שהעז, שומו שמיים, לחטוף מגפון. מפגינים ברברים ופריבילגים. https://t.co/p8TyrapwAL"
SaraHaetzniCohe,1689087753,21568,654,31,59,"אושרה לרר שייב היתה הממונה על שוויון בין המינים בחינוך וממונה על תכנית קרב במשרד החינוך. ד""ר אושרה לרר יש לציין.
זו התייחסות שלה לגבי ילדי מתנחלים: 
""הרווחה לא לוקחת לכם את הילדים כי אף אחד לא יירצה אותם"".

והיא היתה אחראית על משהו בחינוך ילדינו. אלוהים שישמור. https://t.co/G6iTfkNqYS"
SaraHaetzniCohe,1689073432,1634,17,2,0,להלן. דוגמא מס' 4 https://t.co/GWtj94r5Pn
SaraHaetzniCohe,1689073373,1857,22,1,0,להלן. דוגמא מס' 3 https://t.co/pnvGoTmU9L
SaraHaetzniCohe,1689071562,128,0,1,0,"@YoYoavdekel כן, מאד מכובדת https://t.co/uyqn4vgHxp"
SaraHaetzniCohe,1689071047,1037,10,2,1,@YoYoavdekel אולי גם עכשיו https://t.co/mIOHvtgZWS
SaraHaetzniCohe,1689071019,1966,46,2,1,להלן. דוגמא מס' 2 https://t.co/t7KDhBLKeg
SaraHaetzniCohe,1689070983,2071,58,1,1,להלן. דוגמא מס' 1 https://t.co/jZpW1EnnJc
SaraHaetzniCohe,1689070962,920,11,3,0,@YoYoavdekel אולי עכשיו תבין https://t.co/2TFn3AiRbl
SaraHaetzniCohe,1688886136,56171,359,107,9,"ככה ביג כותבים הודעות לעיתונות? לקהל הרחב? מעבר למהות האומללה, מה זו העילגות הזאת?
אם הילדים שלי היו כותבים ככה, היו יושבים ועוברים סדרת חינוך. https://t.co/QN2N8Nt0GP"
SaraHaetzniCohe,1694123054,1700,67,3,0,איך אהבתי אותה
SaraHaetzniCohe,1692113917,88,1,0,0,@ybklain מזל טוב! ובהצלחה..
SaraHaetzniCohe,1692905277,1443,24,1,1,מרגש מכל כיוון
SaraHaetzniCohe,1689003889,27392,561,117,41,"קפיטול גרסת ""כוח קפלן"""
SaraHaetzniCohe,1689087768,1671,9,1,0,@arnonsegal1 כל הכבוד ארנון אני מעריצה
SaraHaetzniCohe,1692343364,1468,35,2,0,מאמר חשוב
berale_crombie,1694110981,103686,807,532,59,"במדד קפלן יש כאן 100,000 איש לפחות!
צילום: אלקנה כהן https://t.co/mWElBjbEOJ"
berale_crombie,1694281115,24441,916,434,76,מנהיגת מחאת השמאל משווה אותנו לנאצים ובתקשורת מדברים על מזג האוויר. זה נראה לכם נורמלי?!
berale_crombie,1694095802,9687,263,93,45,שימו בסטורי 🇮🇱 https://t.co/yIkZOuAjDA
berale_crombie,1695743156,8790,307,109,50,רוצים לדבר על מגילת העצמאות?! https://t.co/3QcbvJBkTT
berale_crombie,1695017048,14468,706,236,58,מעולם לא עודדה תקשורת ישראל אל מפיצי דיבתה של ישראל בעולם כמו הבוקר הזה. זה לא רק שהמחאה הפכה ל-BDS אלא שכל התקשורת הפכה לחלק מהתעמולה הזו.
berale_crombie,1690831824,17202,800,214,133,"אין לבג""צ סמכות לפסול חוקי יסוד! https://t.co/r5YOq9rOTL"
berale_crombie,1692040878,105369,1165,535,157,"אנשי המחאה מבעירים מדורות מול בית ההארחה בו נופש ראש הממשלה, במטרה למלא את חדרו בעשן ולפגוע בו וברעייתו. זו אלימות לכל דבר וענין וניסיון לפגיעה בבריאותו של אדם. האם לא הגיע הזמן שיקום מנהיג אחד אחראי בשמאל ויגיד לאנשי המחאה עד כאן?! האם אין אפילו צדיק אחד בשמאל שיגיד להם הגזמתם?! https://t.co/WhymBQfrz3"
berale_crombie,1695978595,424549,919,715,133,מדינת היהודים? עיריית גבעתיים מחלקת קנסות ליהודים שהקימו סוכות ברחבי העיר. בושה. https://t.co/gP5shicxF2
berale_crombie,1694024424,13955,377,144,62,"חברים אני כותב לכם מדם ליבי. חצי שנה מחיי השקעתי בקידום הרפורמה. אין מישהו שמחויב לקידום הרפורמה כפי שאני מרגיש.  אני מבקש מכם לא להקשיב לרעשי הרקע. ההפגנה מחר היא על דבר אחד: די לשלטון בג""צ. זו לא הפגנה של ברל'ה אלא של המחנה הלאומי כולו. מחר בשעה 18:00 נפגש מול בית המשפט העליון. https://t.co/9MiVgKSJUR"
berale_crombie,1690361717,28997,639,235,64,"אני אומר למחנה שלי,
אפשר להפסיק עם ההכאה על החזה ורגשות האשמה. אנחנו צריכים לדעת שלפחות במערכה הזו עשינו הכל. באמת הכל. הסכמנו לעצירת החקיקה, השהנו את הרפורמה למשך שלושה חודשים לניסיון הידברות בבית הנשיא, ניהלנו מו""מ והסכמנו כמעט לכל פשרה, העיקר שהצד השני יבוא להסכמה. גם אחרי &gt;&gt;"
berale_crombie,1691871500,55928,1185,239,78,אַל תִּתְיָרֵא מִן הַפְּרוּשִׁים אֶלָּא מִן הַצְּבוּעִים https://t.co/p7XWIhLr6i
berale_crombie,1692218157,30349,829,351,60,הכי מרושע בסרטון הוא החיוך הסדיסטי הזה של הניצחון. הנה השפלנו אותם. גועל נפש. https://t.co/gxRmHYNw4N
berale_crombie,1690738553,20937,312,90,29,"הרבה אנשים שואלים אותי בימין אם יש מה לעשות נגד שטיפת המוח של הציבור השמאלי שבאמת בטוח שהולכים להקים פה מדינת הלכה, לזרוק להט""בים מהגגות ולחייב כל נער להניח תפילין. ואני עונה להם שזה בדיוק כמו אותם אנשים שהגיעו אליך בזמן מגיפת הקורונה, כשסוף סוף הגיעו החיסונים, ושכנעו אותך &gt;&gt;&gt;"
berale_crombie,1690547799,29691,862,411,103,"מעניין מי ייצא להפגין במוצ""ש אחרי שמר רדמן חשף שהאסטרטגיה של המחאה היא למוטט את המדינה ולגרום לאזרחים לקרוס?! רק מזוכיסטים."
berale_crombie,1690898531,24056,622,321,77,"חזרתי לאחרונה משבועיים בניו יורק. השמאל חרך את דעת הקהל בקמפיין נגד ישראל. הצליח להשמיץ את המדינה ולעשות נזק ש-BDS לא עשו. לכן נתניהו כעת בבליץ ראיונות לתקשורת הזרה, צריך לספר שלא צמחו לנו קרניים ולא זורקים כאן להט""בים מגגות. השמאל שמשתולל נגד זה רוצה שנמשיך להיות מושמצים בעולם."
berale_crombie,1690484031,15813,531,158,83,"לקרא ולא להאמין. האסטרטגיה הרשמית של המחאה היא פשוט לגרום למצב כאן להיות הכי רע שאפשר, לפגוע בכלכלה ולנסות למוטט את האזרחים עד שיקרסו, העיקר להפיל את הממשלה. מזעזע. https://t.co/wvesuM3fUZ"
berale_crombie,1695816147,2778,55,14,2,חבל דווקא פרגנתי לבחור הזה. אבל נראה שכל אחד בקואליציה שלא מקבל מספיק צומי הולך לדברר את עצמו לדעת ולספר כמה צריכים לעצור את החקיקה. חבל. https://t.co/OFjbdPafO1
berale_crombie,1694521544,14251,912,184,41,רוטמן אתה פשוט גאווה! 🇮🇱
berale_crombie,1696512751,9780,372,121,25,"מי שיצא מהסוכה כדי לא להיות בה עם השר וסרלוף וח""כ סוכות, לא רק עבר על הלבנת פנים, אלא בעיקר קרע מעל עצמו את מסיכת הצביעות. הוא קורא לנו בצדקנות להקשיב לאחר ולהתעלות מעל הסטיגמות - עד שאותו אחר הם ימניים שלא באים לו בטוב. דווקא היה לו הרבה טוב לראות בשני שליחי הציבור הצעירים האלה. https://t.co/QeYp5HeqXg"
berale_crombie,1692220328,20361,367,220,42,"לתשומת ליבן של כל הפמיניסטיות הגדולות: לפי החוק הישראלי מה שעשו היום נשות ""אחים לנשק"" זו הטרדה מינית. https://t.co/ugiiuQ68XQ"
berale_crombie,1692516759,19177,1086,108,116,איילון הבוקר 🇮🇱 https://t.co/uiJzc5cU7P
berale_crombie,1692217015,8806,180,137,7,"הכי מגוחך שהם קוראים לעצמם ""אחים"" לנשק😥"
berale_crombie,1695744850,741,17,1,0,@Guy_Baruch ❤️🧡💛
berale_crombie,1696346660,14024,679,114,124,"לאיזו שקמה ברסלר להאמין, לזו שאומרת כאן בסרטון שאם היתה בתל אביב ביום כיפור היתה מצטרפת לפוגרום נגד התפילה ביום הקדוש, או לשקמה שחתמה על מכתב ציני שבו התנערה מהמפריעים לתפילה? https://t.co/fL5iNGP9mV"
berale_crombie,1692255361,24193,973,294,136,"ברור לכם שמחאה שהממן שלה היה חבר של ארכי פדופיל לא באמת מודאגת משוויון לנשים, נכון?! https://t.co/tdoqYCQXpT"
berale_crombie,1695315285,39636,1813,263,253,"לכל הצקצקנים: היוזמה הזו בטיימס סקוור של @23tkuma נעשתה בשיתוף פעולה מלא עם יהודים מהקהילה היהודית בניו יורק. תומכי ישראל ואוהדי נתניהו שהחליטו להפסיק להבליג על התקפות ""אחים לנשק"" ושאר מכפישי ישראל. וזו רק ההתחלה. הפסקנו לשתוק! 🇮🇱 (צילום: יוסי ג'רופי) https://t.co/CoKbXrOnBt"
berale_crombie,1692215273,39778,1873,108,303,"תזכורת איך התנהגו נשות ""אחים לנשק"" כשהן הגיעו לחווארה. ואלו אותן נשים שהולכות לבני ברק כדי להתגרות. https://t.co/MWUrfOtlEV"
berale_crombie,1695332325,737,24,2,1,@TheEDan4 @23tkuma https://t.co/JtokO3Yq2C
berale_crombie,1695332295,621,14,1,0,@EyalZivIL @23tkuma יש דגל🇮🇱
berale_crombie,1690233842,66191,1674,590,186,"אהוד ברק יצא הבוקר בטיסה ללונדון. ההערכה כי טס למסע גיוס כפסים נוסף של מליוני דולרים ויורו למחאה ""העממית"". https://t.co/AYsHqjD2pG"
berale_crombie,1693675020,21944,1264,340,137,"הזדמנות מצוינת להזכיר שהאריתראים כאן בגלל בג""צ. רפורמה עכשיו!"
berale_crombie,1696696785,48717,525,519,30,"ממשלת ימין ""מלא מלא"" מוחקת את עזה עכשיו!"
berale_crombie,1691360580,21105,532,176,38,"שאלה לפני השינה: אם הרועה היהודי חטף אבן שכמעט רוצצה לו את הגולגולת, איך לא היה בסכנת חיים?!"
berale_crombie,1690837441,20961,628,121,39,השמאל הפגין הערב נגד הקמת ישוב חדש בגליל. זהו אין פאנצ'.
berale_crombie,1696437388,14883,708,180,47,יש סיבה למה הם כל כך שונאים את רוטמן ומנסים בכל דרך להשמיץ אותו. גם בשקרים ומניפולציות. הם פשוט יודעים שהוא הרבה יותר רציני מהם. קנאים. https://t.co/9gcvxVVN5C
berale_crombie,1694168198,45121,504,458,43,"אחיי ואחיותי היקרים, תודה לכם!
תודה לרבבות שהגיעו אמש. בלי קמפיין במליוני שקלים, בלי תקשורת מגויסת שמנפחת מספרים. ובעיקר בלי שנאה, אלא באהבה. אהבה למדינה, לחיילי צה""ל, לציונות, ולמסורת ישראל. אנחנו באמצע הדרך ואנחנו ממשיכים בכל הכח! ואנחנו ננצח! 🇮🇱
אוהב אתכם ❤️ https://t.co/8F2rRisVp6"
berale_crombie,1692515256,26849,920,159,103,"שלום מתן כהנא,
בפני מי אתה מתרפס? למי אתה מתחנן שתיתן לך לנאום? למי רצית להגיד תודה? לסוכנת הכאוס, ידו הארוכה של אהוד ""גופות בירקון"" ברק?! זו שבעיצומה של מגיפה עולמית הקימה את ""הדגלים השחורים"" כדי לזרוע פירוד וכאוס ולפורר את המדינה מבפנים? למי ששלוש שנים מסיתה נגד הימין, עוד &gt;&gt; https://t.co/Jw6JOGvBnl"
berale_crombie,1692212998,24589,601,298,50,"קבוצת נשים לבושה בחולצות ""אחים לנשק"" עלו היום לאוטובוס של חרדים והחלה לשיר במטרה לכפות עליהם לשמוע שירת נשים בניגוד לרצונם. מה המטרה אתם שואלים?! סדיזם. וזה מתחיל להיות מאפיין מרכזי במחאה."
berale_crombie,1689951886,12458,572,149,107,מדינה שבה קציני הצבא מארגנים מרד נגד הממשלה שנבחרה ברוב דמוקרטי - היא מדינה שמתרחשת בה הפיכה צבאית. ומאחורי כל הטירוף והאנרכיה עומד אהוד ברק שניסה להיבחר לכנסת ונכשל. https://t.co/hU7YXl4qin
berale_crombie,1696702169,20672,408,138,36,חיילינו עכשיו בהקפות שניות בגדוד 13 שתופסים קו ברצועה. עם ישראל ינצח! 🇮🇱 https://t.co/DkI01VA46p
berale_crombie,1696695367,83160,626,1031,18,אחים אנחנו! באמת. זמן לאחדות! פליז חברים בואו נתעורר.
berale_crombie,1696700519,13738,155,285,5,"זמן לאחדות אמיתית. בלי החרמות. בלי הצהרות על אחדות ""ללא הקיצוניים"". בלי להמשיך לפלג ולשסע בשעה קשה מנשוא זו. אסור לתת למחלוקות הפוליטיות לנהל אותנו גם עכשיו. חייבים לשים בצד את הוויכוחים ולהתעלות לגודל השעה."
berale_crombie,1691345125,16373,511,198,89,"מפלגת המחאה ניהלה עד כה קמפיין במאות מליונים שהתקבלו מטייקונים ובעלי הון מהארץ והעולם. אם אכן כפי שמסתבר כעת הכל היה במטרה להשיק בסוף התהליך מפלגה בראשות שקמה, רדמן ושות' יש מצב שיש כאן חשש למימון מפלגות אסור וכמובן הון-שלטון קלאסי. פרשת העמותות 2 שוב בכיכוב ברק. האם תפתח חקירה?!"
berale_crombie,1691260230,44019,1442,611,100,"בעקבות ההתנפלות גסת הרוח שוב על אנשי ימין לאחרונה בתכנית אופירה וברקו בערוץ 12, פרופ' טליה איינהורן, עו""ד דוד פורר ויהודה שלזינגר, לא אשתתף יותר בתוכנית כפאנליסט קבוע. הופעתי בתוכנית בחצי שנה האחרונה ותודה לכל הצוות המקסים, פז, נורית והשאר. ניסיתי להשמיע קול אחר. כעת מעדיף לוותר."
berale_crombie,1695997397,29743,353,73,6,"@kunikran מר קוניק, 
אני לא תושב גבעתיים ככה שלא ברור מה אתה רוצה ממני.. ובעיר שבה אני מתגורר ראש העיר לא מציק סתם לתושבים. ראיתי את המקרה והוא קומם אותי וצייצתי (כמובן על דעתי) בתקווה שאולי תפתח את ליבך בחג הסוכות. עדיין לא מאוחר..  לא הכל פוליטיקה בחיים.
חג שמח!🌸"
berale_crombie,1690653919,99593,1219,570,165,"תזכורת:

השמאל מכניע את הימין ב-93: חותם את הסכמי אוסלו וקובע את גבולות הארץ, על חודם של 61 קולות והמיצובישי של גולדפרב.

השמאל מכניע את הימין ב-2005: עוקר 25 ישובים ומגרש 10,000 יהודים מבתיהם.

הימין ""מכניע"" את השמאל ב-2023: מעביר חקיקה לתיקון סמלי בעילת הסבירות בנוסח מרוכך."
berale_crombie,1690222233,65337,2074,403,263,"""אממאאא הם שברו לנו את החלון!!!!"" תראו את הפחד בעיניים של הילדים האלה ותבינו שיש לנו עסק עם אנשים שטופי מוח ששוכנעו עד עומק נשמתם שאנחנו האויב. וזה אירוע מסוכן מאד. https://t.co/5Gbx15zB7o"
berale_crombie,1690230998,32458,465,740,35,"אנחנו מושיטים היום את ידינו לפיוס!
אנחנו המחנה שנשבע ""לעולם לא מלחמת אחים!"" אומרים לאחינו מתנגדי הרפורמה - אתם לא האויב שלנו ואנחנו לא האויבים שלכם. אחים אנחנו! https://t.co/cFmaKAD6QN"
berale_crombie,1690225383,5698,383,52,43,מה שקרה אתמול בקפלן זה עוצמות של אהבה. מחנה שמרים את הראש ויודע שהוא לא יהיה יותר אזרחים סוג ב'. צילום ועריכה: קובי שומר. https://t.co/ta02q9Eg5Q
berale_crombie,1695666916,10987,556,166,31,"רוצים לדבר על מגילת העצמאות?! ""בארץ ישראל קם העם *היהודי*""!!!!"
berale_crombie,1695663913,10616,605,207,53,"אם היו מספרים לחוזי המדינה היהודית שיום יבוא וכאן בארץ ישראל בלב העיר העברית הראשונה, יהודים יתקפו יהודים בגיבוי רשויות החוק, רק בגלל שהם מתפללים לפי דתם ביום כיפור, אין סיכוי שהם היו מאמינים. בושה."
berale_crombie,1693980553,54976,430,493,45,"אחיי למחנה. הבעיה היא לא נתניהו, הבעיה היא אנחנו. תקראו לי ביביסט, תקראו לי תמים. אבל בסופו של דבר נכשלנו. ואני אומר את זה קודם כל לעצמי. לא הבנו את הכוחות האדירים שבצד השני. לא הבנו עד כמה רחוק יסכימו ללכת במחאת השמאל כדי לנגח את הממשלה, כולל אלימות, סרבנות, פילוג העם, BDS ועוד&gt;"
berale_crombie,1692872705,9314,986,51,102,צהריים טובים משדרות בגין ירושלים 🇮🇱 https://t.co/MyyiSirGUb
berale_crombie,1692864819,9771,803,44,95,בוקר טוב ירושלים 🇮🇱 https://t.co/LACNX5phsT
berale_crombie,1689701202,104897,1470,333,316,יום ראשון הקרוב הימין מגיע לתל אביב! 🇮🇱 https://t.co/Re0uzV2bfa
berale_crombie,1691475489,22513,1377,217,144,"בוקר טוב על איילון 🇮🇱
במדינה דמוקרטית העם הוא הריבון! https://t.co/jRgD0BL7Xn"
berale_crombie,1692269300,7721,436,93,92,שימו בסטורי 🇮🇱 https://t.co/P4i6nuoRA8
berale_crombie,1694279389,61866,1203,546,142,"שבוע טוב
למה אף אחד בתקשורת לא מדבר על הנוכחות הדלילה במחאת קפלן הגוועת?
למה אף עיתון לא פרסם תחקיר על הקרבות הפנימיים בין ראשי המחאה והסכינים שננעצים מאחורי הגב?
ואיך בתקשורת ממשיכים לחפות על המחאה אבל את הפגנות הימין בודקים בזכוכית מגדלת?
אין תקשורת בישראל. רק להקת מעודדות..."
berale_crombie,1694176970,45391,404,307,58,"*מארגני עצרת הימין אמש ח""כ אביחי בוארון וברל'ה קרומבי:*

המדבקות שהופצו אמש עם מספר כיתובים פרובוקטוריים בהפגנת הימין הופצו על ידי פרובוקטורים שהגיעו לפגוע בהפגנה במטרה להשחיר את פניהם של רבבות מפגיני הימין שנטלו חלק בהפגנה אמש ולהשחיר את פניו של המחנה הימין כולו.

על המדבקות &gt;&gt;"
berale_crombie,1694176971,6208,133,17,12,"נכתב שמו של ארגון בשם ""ימנים"" כאילו הוא עומד מאחורי הפצת המדבקות. אך מבדיקה שערכנו הארגון כלל לא ידע על קיומם של המדבקות ולא הוא הפיץ אותם, כך שגורם בעל אינטרס ברור בחר להשתמש בשמו של ארגון עם שם המייצר זיהוי עם הימין כדי לפגוע בשמם הטוב של המפגינים. המסקנה ברורה.

30 שנה אחרי &gt;&gt;"
berale_crombie,1694176972,7569,160,91,16,"ימי ""אוסלו"" השמאל לא למד כלום ובדיוק כפי שבאותם ימים הופצו תמונותיו של ראש הממשלה יצחק רבין ז""ל במדי אס.אס על ידי הפרובוקטור אבישי רביב, כך היום מנסים גורמים מסוימים לפגוע בשמם הטוב של מפגיני הימין במטרה לפגוע במאבקם הדמוקרטי לקידום הרפורמה המשפטית. &gt;&gt;"
berale_crombie,1694176972,7435,187,43,16,אנו בוחנים את הצעדים המשפטיים במטרה לאתר עדים שראו את אותם פרובוקטורים שהפיצו את המדבקות ותוגש נגדם תלונה במשטרה.
